query_run_date,query_period,periods_back,days_back,raw_result_count,compared_result_count,date_query_start,date_query_end,doc_id,domain,title,date_published,collection,tags,urlsummary
"2014-04-18","months","4","124","137","","2013-12-15","2014-01-15","haiyan-google-media_Traditional-bbc.co.uk-001-010_m4(06)","bbc.co.uk","BBC News - Typhoon Haiyan: More aid on way for Philippines victims","2014/01/06 15:57:18","haiyan","google-media","http://www.bbc.co.uk/news/uk-england-25628192""The devastation in the Philippines caused by a typhoon two months ago has <br> dropped out of the headlines but the massive relief effort is expected to carry on <br> for&nbsp;..."
"2014-04-18","months","5","155","393","","2013-11-14","2013-12-15","haiyan-google-media_Traditional-bbc.co.uk-001-010_m5(02)","bbc.co.uk","BBC News - Typhoon Haiyan death toll rises over 5,000","2013/11/22 13:14:05","haiyan","google-media","http://www.bbc.co.uk/news/world-asia-25051606""The death toll from <b>Typhoon Haiyan</b> has risen above 5000, officials in the <br> Philippines say, two weeks after the devastating storm."
"2014-04-18","months","5","155","393","","2013-11-14","2013-12-15","haiyan-google-media_Traditional-bbc.co.uk-001-010_m5(03)","bbc.co.uk","BBC News - Typhoon Haiyan: Charity helps heal emotional scars","2013/11/22 06:35:31","haiyan","google-media","http://www.bbc.co.uk/news/world-asia-25047459""Psychologists are counselling survivors of <b>Typhoon Haiyan</b> in the Philippines as <br> they struggle to cope ... By Tulip Mazumdar BBC <b>News</b>, Guiuan, Philippines."
"2014-04-18","months","5","155","393","","2013-11-14","2013-12-15","haiyan-google-media_Traditional-bbc.co.uk-001-010_m5(07)","bbc.co.uk","BBC News - Typhoon Haiyan: Rebuilding lives in Tacloban","2013/11/22 04:37:47","haiyan","google-media","http://www.bbc.co.uk/news/world-asia-25046721""It has been two weeks since <b>Typhoon Haiyan</b> hit the Philippines, leaving at least <br> 4000 people dead and large parts of the country devastated."
"2014-04-18","months","5","155","393","","2013-11-14","2013-12-15","haiyan-google-media_Traditional-bbc.co.uk-001-010_m5(10)","bbc.co.uk","BBC News - Typhoon Haiyan: A month on the ground","2013/12/07 01:26:48","haiyan","google-media","http://www.bbc.co.uk/news/world-asia-25258355""One month since <b>Typhoon Haiyan</b> slammed into the Philippines, we look back at <br> the key moments from the villages, towns and cities hit by one of the strongest&nbsp;..."
"2014-04-18","months","6","186","538","","2013-10-14","2013-11-14","haiyan-google-media_Traditional-bbc.co.uk-001-010_m6(02)","bbc.co.uk","BBC News - Typhoon Haiyan: Before and after the storm","2013/11/13 12:31:51","haiyan","google-media","http://www.bbc.co.uk/news/world-24899001""Satellite and aerial images of before and after <b>Typhoon Haiyan</b> show the extent <br> of the devastation wreaked by the storm in low-lying areas of the central&nbsp;..."
"2014-04-18","months","6","186","538","","2013-10-14","2013-11-14","haiyan-google-media_Traditional-bbc.co.uk-001-010_m6(03)","bbc.co.uk","BBC News - Typhoon Haiyan: BBC reports from the Philippines","2013/11/14 23:13:53","haiyan","google-media","http://www.bbc.co.uk/news/world-asia-24906181""A selection of reports from BBC reporters on the devastation caused by <b>Typhoon</b> <br> <b>Haiyan</b> and the rescue operation that has followed."
"2014-04-18","months","6","186","538","","2013-10-14","2013-11-14","haiyan-google-media_Traditional-bbc.co.uk-001-010_m6(05)","bbc.co.uk","BBC News - Typhoon Haiyan: Philippines destruction &apos;absolute ...","2013/11/11 11:46:09","haiyan","google-media","http://www.bbc.co.uk/news/world-asia-24894529""The Philippine Red Cross says the devastating <b>Typhoon Haiyan</b> has created ... <br> Haiyan - named &quot;<b>Yolanda</b>&quot; by Filipino authorities - barrelled into the eastern&nbsp;..."
"2014-04-18","months","6","186","538","","2013-10-14","2013-11-14","haiyan-google-media_Traditional-bbc.co.uk-001-010_m6(06)","bbc.co.uk","BBC News - Typhoon Haiyan: Philippines declares state of calamity","2013/11/12 01:48:37","haiyan","google-media","http://www.bbc.co.uk/news/world-asia-24901993""Philippine President Benigno Aquino has declared a state of national calamity to <br> speed relief efforts for victims of <b>Typhoon Haiyan</b>. In a statement, he said the&nbsp;..."
"2014-04-18","months","6","186","538","","2013-10-14","2013-11-14","haiyan-google-media_Traditional-bbc.co.uk-001-010_m6(07)","bbc.co.uk","BBC News - Typhoon Haiyan: Thousands feared dead in Philippines","2013/11/10 11:30:58","haiyan","google-media","http://www.bbc.co.uk/news/world-asia-24887337""Officials say up to 10000 people may have died on Leyte island, which bore the <br> brunt of the devastation of <b>Typhoon Haiyan</b> in the Philippines."
"2014-04-18","months","6","186","538","","2013-10-14","2013-11-14","haiyan-google-media_Traditional-bbc.co.uk-001-010_m6(08)","bbc.co.uk","BBC News - Typhoon Haiyan: Philippines battles to bring storm aid","2013/11/10 22:21:38","haiyan","google-media","http://www.bbc.co.uk/news/world-asia-24887746""Officials struggle to bring aid to areas of the Philippines worst affected by <br> <b>Typhoon Haiyan</b>, with up to 10000 people feared dead in Tacloban city."
"2014-04-18","months","6","186","538","","2013-10-14","2013-11-14","haiyan-google-media_Traditional-bbc.co.uk-001-010_m6(09)","bbc.co.uk","BBC News - Typhoon Haiyan: Hundreds feared dead in Philippines","2013/11/09 20:54:51","haiyan","google-media","http://www.bbc.co.uk/news/world-asia-24878801""Hundreds of people are feared dead in the Philippines after <b>Typhoon Haiyan</b> <br> swept through on Friday. Among the worst hit areas were the eastern island of&nbsp;..."
"2014-04-18","months","6","186","538","","2013-10-14","2013-11-14","haiyan-google-media_Traditional-bbc.co.uk-001-010_m6(10)","bbc.co.uk","BBC News - Monster typhoon Haiyan roars across Philippines","2013/11/08 20:22:09","haiyan","google-media","http://www.bbc.co.uk/news/world-asia-24846813""Packing sustained winds of up to 320 km/h (199mph), <b>Typhoon Haiyan</b> left at <br> least four people dead, but it may be days before the full damage is known."
"2014-04-18","months","1","31","20","","2014-03-18","2014-04-18","haiyan-google-media_Traditional-cbc.ca-001-010_m1(01)","cbc.ca","CBC News - Global warming dials up our risks, UN report says","","haiyan","google-media","http://www.cbc.ca/m/touch/technology/story/1.2592307""Freaky storms like 2013&#39;s <b>Typhoon Haiyan</b>, 2012&#39;s Superstorm Sandy and 2008&#39;s <br> ultra-deadly Cyclone Nargis may not have been caused by warming, but their&nbsp;..."
"2014-04-18","months","1","31","20","","2014-03-18","2014-04-18","haiyan-google-media_Traditional-cbc.ca-001-010_m1(02)","cbc.ca","Pharrell teams with UN to make people Happy - The Buzz","","haiyan","google-media","http://www.cbc.ca/newsblogs/arts/the-buzz/2014/03/pharrell-teams-with-un-to-make-people-happy.html""CBC <b>News</b> Arts &amp; Entertainment. Major StoriesIn The <b>News</b> ... Dancers cavort <br> amidst the rubble that still exists after 2013&#39;s <b>Typhoon Haiyan</b>, the deadliest&nbsp;..."
"2014-04-18","months","1","31","20","","2014-03-18","2014-04-18","haiyan-google-media_Traditional-cbc.ca-001-010_m1(03)","cbc.ca","Kamloops man moves to help the Philippines full-time | CBC ...","","haiyan","google-media","http://www.cbc.ca/kamloops/mt/2014/03/20/kamloops-man-moves-to-help-the-philippines-full-time/""The latest <b>news</b> from across Canada and around the world. ... north of Cebu, rely <br> on themselves to recover after <b>Typhoon Haiyan</b> (photo by Grant Iverson)."
"2014-04-18","months","1","31","20","","2014-03-18","2014-04-18","haiyan-google-media_Traditional-cbc.ca-001-010_m1(04)","cbc.ca","5 Different Ways of Looking At Happiness","","haiyan","google-media","http://www.cbc.ca/strombo/news/5-different-ways-of-looking-at-happiness""... shot in the city of Tacloban, which was hit hard by <b>Typhoon Haiyan</b> last <br> November: Related. Smile: It&#39;s The First Ever International Day Of Happiness Alt <br> <b>News</b>."
"2014-04-18","months","1","31","20","","2014-03-18","2014-04-18","haiyan-google-media_Traditional-cbc.ca-001-010_m1(05)","cbc.ca","CBC.ca | The Bridge","","haiyan","google-media","http://www.cbc.ca/thebridge/author/michael_evans/""CBC <b>News</b> Navigation ... A Windsor musician is hoping a major fundraiser with <br> the WSO will help people in the Filipines recover from <b>Typhoon Haiyan</b>."
"2014-04-18","months","1","31","20","","2014-03-18","2014-04-18","haiyan-google-media_Traditional-cbc.ca-001-010_m1(06)","cbc.ca","podcasting","","haiyan","google-media","http://www.cbc.ca/podcasting/includes/bconthecoast.xml""On The Coast is a great way to catch up on the day&#39;s <b>news</b>, and get connected ..... <br> wants to bring daughter and orphaned niece to Canada, after <b>Typhoon Haiyan</b>"
"2014-04-18","months","1","31","20","","2014-03-18","2014-04-18","haiyan-google-media_Traditional-cbc.ca-001-010_m1(07)","cbc.ca","Archives | CBC Kamloops","","haiyan","google-media","http://www.cbc.ca/kamloops/archives/""Daybreak has been bringing you exclusive <b>coverage</b> of this topic over the last ..... <br> rely on themselves to recover after <b>Typhoon Haiyan</b> (photo by Grant Iverson)."
"2014-04-18","months","1","31","20","","2014-03-18","2014-04-18","haiyan-google-media_Traditional-cbc.ca-001-010_m1(08)","cbc.ca","Residential schools and hockey - The National - CBC Player","Mar 26, 2014","haiyan","google-media","http://www.cbc.ca/player/Shows/Shows/The+National/About+the+Show/Duncan+McCue/ID/2444913776/""TV &middot; Radio &middot; <b>News</b> &middot; Sports &middot; Digital Archives .... towards relief efforts in the <br> Philippines are starting to make a difference in the wake of <b>Typhoon Haiyan</b>."
"2014-04-18","months","1","31","20","","2014-03-18","2014-04-18","haiyan-google-media_Traditional-cbc.ca-001-010_m1(09)","cbc.ca","Newscasts | Learning English | CBC Calgary","","haiyan","google-media","http://www.cbc.ca/calgary/learning-english/newscasts.html""Newscasts. Newscasts contain current <b>news</b> stories read at a slower pace than <br> you normally hear on the radio. These are prepared by CBC <b>News</b> Calgary."
"2014-04-18","months","1","31","20","","2014-03-18","2014-04-18","haiyan-google-media_Traditional-cbc.ca-001-010_m1(10)","cbc.ca","CBC.ca | The Homestretch","","haiyan","google-media","http://www.cbc.ca/homestretch/episode/2014/04/""CBC <b>News</b> Navigation. Home &middot; <b>News</b> &middot; Events &middot; Weather &middot; Programs ..... Thu., 14 – <br> Torah Kachur: <b>Typhoon Haiyan</b>. Thu., 14 – Dry Skin. Thu., 14 – Radio play,&nbsp;..."
"2014-04-18","months","2","62","40","","2014-02-15","2014-03-18","haiyan-google-media_Traditional-cbc.ca-001-010_m2(01)","cbc.ca","Mitch Albom launches Philippine library-rebuilding effort - Arts ...","","haiyan","google-media","http://www.cbc.ca/news/arts/mitch-albom-launches-philippine-library-rebuilding-effort-1.2551009""... launched a drive to rebuild 10 libraries in Tacloban, the central Philippine city <br> ravaged by <b>Typhoon Haiyan</b> in November. ... CBC <b>News</b> Arts &amp; Entertainment&nbsp;..."
"2014-04-18","months","2","62","40","","2014-02-15","2014-03-18","haiyan-google-media_Traditional-cbc.ca-001-010_m2(05)","cbc.ca","Malaysia Airlines Flight MH370 search crowdsourced by U.S. firm ...","","haiyan","google-media","http://www.cbc.ca/news/world/malaysia-airlines-flight-mh370-search-crowdsourced-by-u-s-firm-1.2568677""Major StoriesIn The <b>News</b> ... CBC <b>News</b> Navigation ... DigitalGlobe used a <br> crowdsourcing campaign when <b>Typhoon Haiyan</b> struck the Philippines in <br> November,&nbsp;..."
"2014-04-18","months","2","62","40","","2014-02-15","2014-03-18","haiyan-google-media_Traditional-cbc.ca-001-010_m2(06)","cbc.ca","Recent Stories - Go Public","","haiyan","google-media","http://www.cbc.ca/thenational/indepthanalysis/gopublic/gp-archives2.html""The National. Find Out When to Watch » CBC <b>News</b> ... Canadian benefactors <br> pledged $59,000 for her to study here in wake of <b>Typhoon Haiyan</b>. Diamond and<br> &nbsp;..."
"2014-04-18","months","2","62","40","","2014-02-15","2014-03-18","haiyan-google-media_Traditional-cbc.ca-001-010_m2(08)","cbc.ca","Blog Archive | The Current with Anna Maria Tremonti | CBC Radio","","haiyan","google-media","http://www.cbc.ca/thecurrent/episode/environment/""Post <b>Typhoon Haiyan</b> are superstorms the new normal? Wednesday, November <br> 13, 2013 | Categories: Environment, Episodes, International |. Listen&nbsp;..."
"2014-04-18","months","3","93","85","","2014-01-15","2014-02-15","haiyan-google-media_Traditional-cbc.ca-001-010_m3(01)","cbc.ca","Eileen Mangubat, Philippine journalist, reflects on Typhoon Haiyan ...","","haiyan","google-media","http://www.cbc.ca/news/canada/british-columbia/eileen-mangubat-philippine-journalist-reflects-on-typhoon-haiyan-1.2540133""In November 2013, <b>Typhoon Haiyan</b> ripped a path of devastation through the ... <br> CBC <b>News</b> Posted: Feb 17, 2014 10:24 AM PT Last Updated: Feb 19, 2014 8:19<br> &nbsp;..."
"2014-04-18","months","3","93","85","","2014-01-15","2014-02-15","haiyan-google-media_Traditional-cbc.ca-001-010_m3(03)","cbc.ca","Winnipeg&apos;s Filipino community holds town hall meeting - Manitoba ...","","haiyan","google-media","http://www.cbc.ca/news/canada/manitoba/winnipeg-s-filipino-community-holds-town-hall-meeting-1.2529885""CBC <b>News</b> Posted: Feb 09, 2014 5:45 PM CT Last Updated: Feb 09, 2014 5:45 ... <br> reports about delays in sending donations for <b>Typhoon Haiyan</b> relief efforts."
"2014-04-18","months","3","93","85","","2014-01-15","2014-02-15","haiyan-google-media_Traditional-cbc.ca-001-010_m3(08)","cbc.ca","RIM shares sink to lowest since 2003 - Technology &amp; Science - CBC ...","","haiyan","google-media","http://www.cbc.ca/news/technology/rim-shares-sink-to-lowest-since-2003-1.1245403""CBC <b>News</b> Technology &amp; Science .... With files from CBC <b>News</b>. © The Canadian <br> Press .... <b>Typhoon Haiyan</b> creates testing ground for crisis mappers. Analysis."
"2014-04-18","months","4","124","182","","2013-12-15","2014-01-15","haiyan-google-media_Traditional-cbc.ca-001-010_m4(01)","cbc.ca","Hamilton doctor returns from Philippine typhoon Haiyan relief efforts ...","","haiyan","google-media","http://www.cbc.ca/news/canada/hamilton/news/hamilton-doctor-returns-from-philippine-typhoon-haiyan-relief-efforts-1.2494915""By Sola DaSilva, CBC <b>News</b> Posted: Jan 14, 2014 9:29 AM ET Last Updated: ... <br> <b>Typhoon Haiyan</b> – locally known as <b>Yolanda</b> – created widespread destruction&nbsp;..."
"2014-04-18","months","4","124","182","","2013-12-15","2014-01-15","haiyan-google-media_Traditional-cbc.ca-001-010_m4(03)","cbc.ca","Typhoon Haiyan victim tests Canada&apos;s commitment to help - British ...","","haiyan","google-media","http://www.cbc.ca/news/canada/british-columbia/typhoon-haiyan-victim-tests-canada-s-commitment-to-help-1.2496688""A single mother who lost 10 family members in <b>Typhoon Haiyan</b> is testing the ... <br> CBC <b>News</b> Posted: Jan 14, 2014 5:56 PM PT Last Updated: Jan 14, 2014 6:02&nbsp;..."
"2014-04-18","months","4","124","182","","2013-12-15","2014-01-15","haiyan-google-media_Traditional-cbc.ca-001-010_m4(04)","cbc.ca","Hamilton doctor off to Philippines to help victims of typhoon Haiyan ...","","haiyan","google-media","http://www.cbc.ca/news/canada/hamilton/news/hamilton-doctor-off-to-philippines-to-help-victims-of-typhoon-haiyan-1.2470744""<b>Typhoon Haiyan</b> slammed the Philippines in early November, killing over ... CBC <br> <b>News</b> Posted: Dec 20, 2013 7:06 AM ET Last Updated: Dec 20, 2013 8:08 AM&nbsp;..."
"2014-04-18","months","4","124","182","","2013-12-15","2014-01-15","haiyan-google-media_Traditional-cbc.ca-001-010_m4(05)","cbc.ca","Filipino centre sorry for sitting on Haiyan relief donations - Manitoba ...","","haiyan","google-media","http://www.cbc.ca/news/canada/manitoba/filipino-centre-sorry-for-sitting-on-haiyan-relief-donations-1.2499979""CBC <b>News</b> Posted: Jan 16, 2014 8:12 PM CT Last Updated: Jan 16, 2014 8:52 ... <br> on $72,000 in donations people had raised for <b>Typhoon Haiyan</b> relief efforts."
"2014-04-18","months","4","124","182","","2013-12-15","2014-01-15","haiyan-google-media_Traditional-cbc.ca-001-010_m4(06)","cbc.ca","Visa denial for Filipina nurse Blesida Calusa &apos;frustrating and sad ...","","haiyan","google-media","http://www.cbc.ca/news/canada/nova-scotia/visa-denial-for-filipina-nurse-blesida-calusa-frustrating-and-sad-1.2472208""By Kathy Tomlinson, CBC <b>News</b> Posted: Dec 23, 2013 6:00 AM AT Last Updated: <br> ... In the wake of <b>Typhoon Haiyan</b> in the Philippines, Morehouse said he can&#39;t&nbsp;..."
"2014-04-18","months","4","124","182","","2013-12-15","2014-01-15","haiyan-google-media_Traditional-cbc.ca-001-010_m4(07)","cbc.ca","Filipino centre sorry for sitting on Haiyan relief donations - CBC ...","Jan 16, 2014","haiyan","google-media","http://www.cbc.ca/player/News/Canada/Manitoba/ID/2430569811/""... sitting on $72000 in donations people had raised for <b>Typhoon Haiyan</b> relief <br> efforts. ... <b>News</b> Winnipeg (Late Night) - CBC <b>News</b> Winnipeg at 11 p.m. - April 13<br> &nbsp;..."
"2014-04-18","months","4","124","182","","2013-12-15","2014-01-15","haiyan-google-media_Traditional-cbc.ca-001-010_m4(10)","cbc.ca","CBC News Vancouver at 6","Jan 6, 2014","haiyan","google-media","http://www.cbc.ca/player/Embedded-Only/News/BC/ID/2428450877/""CBC <b>News</b> Vancouver at 6 | Jan 6, 2014 | 30:11 .... Dec 23, 2013 | 2:37Canadian <br> benefactors pledged $59,000 for her to study here in wake of <b>Typhoon Haiyan</b>."
"2014-04-18","months","5","155","527","","2013-11-14","2013-12-15","haiyan-google-media_Traditional-cbc.ca-001-010_m5(01)","cbc.ca","Philippines Typhoon Haiyan death toll tops 5,000 - World - CBC News","","haiyan","google-media","http://www.cbc.ca/news/world/philippines-typhoon-haiyan-death-toll-tops-5-000-1.2436236""The regions were battered two weeks ago by fierce winds and tsunami-like storm <br> surges from <b>Typhoon Haiyan</b>, locally called <b>Yolanda</b>. Del Rosario said there&nbsp;..."
"2014-04-18","months","5","155","527","","2013-11-14","2013-12-15","haiyan-google-media_Traditional-cbc.ca-001-010_m5(02)","cbc.ca","Mass burials may complicate Philippines Typhoon Haiyan recovery ...","","haiyan","google-media","http://www.cbc.ca/news/world/mass-burials-may-complicate-philippines-typhoon-haiyan-recovery-1.2430868""The rush to bury Philippines dead following <b>Typhoon Haiyan</b> could hinder ... By <br> Amber Hildebrandt, CBC <b>News</b> Posted: Nov 20, 2013 5:04 AM ET Last Updated:<br> &nbsp;..."
"2014-04-18","months","5","155","527","","2013-11-14","2013-12-15","haiyan-google-media_Traditional-cbc.ca-001-010_m5(06)","cbc.ca","Typhoon Haiyan creates testing ground for crisis mappers - World ...","","haiyan","google-media","http://www.cbc.ca/news/world/typhoon-haiyan-creates-testing-ground-for-crisis-mappers-1.2462119""By Amber Hildebrandt, CBC <b>News</b> Posted: Dec 18, 2013 5:00 AM ET Last <br> Updated: Dec ... A month after <b>Typhoon Haiyan</b>, signs of progress in the hard-hit <br> Leyte&nbsp;..."
"2014-04-18","months","5","155","527","","2013-11-14","2013-12-15","haiyan-google-media_Traditional-cbc.ca-001-010_m5(07)","cbc.ca","Justin Bieber raises funds for Philippines&apos; Typhoon Haiyan victims ...","","haiyan","google-media","http://www.cbc.ca/news/world/justin-bieber-raises-funds-for-philippines-typhoon-haiyan-victims-1.2457775""Major StoriesIn The <b>News</b> ... For each dollar donated to help <b>Typhoon Haiyan</b> <br> victims through Justin Bieber&#39;s fundraiser, fans get a chance to win an opportunity<br> &nbsp;..."
"2014-04-18","months","5","155","527","","2013-11-14","2013-12-15","haiyan-google-media_Traditional-cbc.ca-001-010_m5(08)","cbc.ca","Typhoon Haiyan turns UBC researchers into rescuers - British ...","","haiyan","google-media","http://www.cbc.ca/news/canada/british-columbia/typhoon-haiyan-turns-ubc-researchers-into-rescuers-1.2431721""CBC <b>News</b> Posted: Nov 19, 2013 9:12 AM PT Last Updated: Nov 19, 2013 7:40 ... <br> and hardest hit villages in the Philippines in the aftermath of <b>Typhoon Haiyan</b>."
"2014-04-18","months","5","155","527","","2013-11-14","2013-12-15","haiyan-google-media_Traditional-cbc.ca-001-010_m5(09)","cbc.ca","Filipino community grateful for Typhoon Haiyan generosity ...","","haiyan","google-media","http://www.cbc.ca/news/canada/newfoundland-labrador/filipino-community-grateful-for-typhoon-haiyan-generosity-1.2461349""CBC <b>News</b> Posted: Dec 12, 2013 1:50 PM NT Last Updated: Dec 12, 2013 1:54 <br> ... been held by various groups and organizations since <b>Typhoon Haiyan</b> struck&nbsp;..."
"2014-04-18","months","5","155","527","","2013-11-14","2013-12-15","haiyan-google-media_Traditional-cbc.ca-001-010_m5(10)","cbc.ca","Philippines Typhoon Haiyan death toll tops 5,000 - Photo Galleries ...","","haiyan","google-media","http://www.cbc.ca/news/world/photos/philippines-typhoon-haiyan-death-toll-tops-5-000-1.2435168""... Canada&#39;s 200-member DART team, pours in to areas ravaged by <b>Typhoon</b> <br> <b>Haiyan</b> but some remote communities remain ... Stay Connected with CBC <b>News</b>."
"2014-04-18","months","6","186","394","","2013-10-14","2013-11-14","haiyan-google-media_Traditional-cbc.ca-001-010_m6(02)","cbc.ca","Typhoon Haiyan survivors in Philippines desperate for aid - World ...","","haiyan","google-media","http://www.cbc.ca/news/world/typhoon-haiyan-survivors-in-philippines-desperate-for-aid-1.2422113""You must be a member of the CBC <b>News</b> Community to upload. Sign Up now. ... <br> Canadians needing urgent consular help following <b>Typhoon #Haiyan</b> can email&nbsp;..."
"2014-04-18","months","6","186","394","","2013-10-14","2013-11-14","haiyan-google-media_Traditional-cbc.ca-001-010_m6(03)","cbc.ca","Typhoon Haiyan: How you can help - World - CBC News","","haiyan","google-media","http://www.cbc.ca/news/world/typhoon-haiyan-how-you-can-help-1.2423429""CBC <b>News</b> Posted: Nov 12, 2013 10:52 AM ET Last Updated: Nov 13, 2013 5:14 <br> PM ET ... to deal with the devastating and deadly effects of <b>Typhoon Haiyan</b>."
"2014-04-18","months","6","186","394","","2013-10-14","2013-11-14","haiyan-google-media_Traditional-cbc.ca-001-010_m6(04)","cbc.ca","Typhoon Haiyan death toll tops 10,000: police - World - CBC News","","haiyan","google-media","http://www.cbc.ca/news/world/typhoon-haiyan-death-toll-tops-10-000-police-1.2420971""<b>Typhoon Haiyan</b> destroyed about 70 to 80 per cent of the area in its path as it tore <br> through the province, said chief superintendent Elmer Soria, a regional police&nbsp;..."
"2014-04-18","months","6","186","394","","2013-10-14","2013-11-14","haiyan-google-media_Traditional-cbc.ca-001-010_m6(07)","cbc.ca","Super typhoon Haiyan slams into central Philippines - World - CBC ...","","haiyan","google-media","http://www.cbc.ca/news/world/super-typhoon-haiyan-slams-into-central-philippines-1.2417858""Major StoriesIn The <b>News</b> ... Super <b>typhoon Haiyan</b> slams into central Philippines<br> . 4 dead after <b>typhoon Haiyan</b> makes landfall with gusts of 275 km/h."
"2014-04-18","months","6","186","394","","2013-10-14","2013-11-14","haiyan-google-media_Traditional-cbc.ca-001-010_m6(08)","cbc.ca","Philippines death toll surpasses 3,600 as rebuilding begins - World ...","","haiyan","google-media","http://www.cbc.ca/news/world/philippines-death-toll-surpasses-3-600-as-rebuilding-begins-1.2427464""<b>Typhoon Haiyan&#39;s</b> aftermath leaves hundreds of thousands homeless. The <br> Associated Press ... You must be a member of the CBC <b>News</b> Community to <br> upload."
"2014-04-18","months","6","186","394","","2013-10-14","2013-11-14","haiyan-google-media_Traditional-cbc.ca-001-010_m6(10)","cbc.ca","Philippines typhoon aid operations pick up pace - World - CBC News","","haiyan","google-media","http://www.cbc.ca/news/world/philippines-typhoon-aid-operations-pick-up-pace-1.2423259""1,883 confirmed dead in wake of <b>Typhoon Haiyan</b>. The Associated Press ... You <br> must be a member of the CBC <b>News</b> Community to upload. Sign Up now."
"2014-04-18","months","1","31","1780","","2014-03-18","2014-04-18","haiyan-google-media_Traditional-cnn.com-001-010_m1(02)","cnn.com","Impact Your World - CNN.com","","haiyan","google-media","http://www.cnn.com/SPECIALS/impact.your.world""Complete <b>coverage</b> on. Impact Your World. FOLLOW THIS TOPIC ... CNN TV | <br> HLN | Transcripts |. © 2014 Cable <b>News</b> Network. Turner Broadcasting System&nbsp;..."
"2014-04-18","months","1","31","1780","","2014-03-18","2014-04-18","haiyan-google-media_Traditional-cnn.com-001-010_m1(03)","edition.cnn.com","CNN Video - Breaking News Videos from CNN.com","","haiyan","google-media","http://edition.cnn.com/video/?hpt=hp_c3""CNN Video - Breaking <b>News</b> Videos from CNN.com. ... Faces of <b>Typhoon Haiyan</b>. <br> Filipinos seek family via CNN iReport. iReporter: Philippines situation is grim."
"2014-04-18","months","1","31","1780","","2014-03-18","2014-04-18","haiyan-google-media_Traditional-cnn.com-001-010_m1(04)","edition.cnn.com","Climate change could cost $100 billion a year - CNN.com","2014-03-31T12:54:04Z","haiyan","google-media","http://edition.cnn.com/2014/03/31/business/cost-climate-change/""<b>Typhoon Haiyan</b>, which swept through Philippines in November, killed 6,000 <br> people and cost more than $10 billion. ... Part of complete <b>coverage</b> on."
