query_run_date,query_period,periods_back,days_back,raw_result_count,compared_result_count,date_query_start,date_query_end,doc_id,domain,title,date_published,collection,tags,urlsummary
"","","","","","","","","","","","","","",""""
"2014-04-18","months","1","31","50100","","2014-03-18","2014-04-18","haiyan-google-media_All-001-010_m1(01)","theguardian.com","Typhoon Haiyan | World news | The Guardian","","haiyan","google-media","http://www.theguardian.com/world/typhoon-haiyan""Latest <b>news</b> and comment on <b>Typhoon Haiyan</b> from the&nbsp;..."
"2014-04-18","months","1","31","50100","","2014-03-18","2014-04-18","haiyan-google-media_All-001-010_m1(02)","wiki.openstreetmap.org","Typhoon Haiyan - OpenStreetMap Wiki","","haiyan","google-media","http://wiki.openstreetmap.org/wiki/Typhoon_Haiyan""<b>Typhoon Haiyan</b> (Wikipedia), also known as Typhoon <b>Yolanda</b>, is a tropical <br> cyclone that devastated the Philippines. It first made landfall at Guiuan, Eastern&nbsp;..."
"2014-04-18","months","1","31","50100","","2014-03-18","2014-04-18","haiyan-google-media_All-001-010_m1(03)","reliefweb.int","Typhoon Haiyan - Nov 2013 | ReliefWeb","","haiyan","google-media","http://reliefweb.int/disaster/tc-2013-000139-phl""(10 Dec, OCHA) <b>Typhoon Haiyan</b> (called <b>Yolanda</b> in the Philippines) ended up <br> becoming the deadliest event of 2013 in the Asia-Pacific, killing more than 6,000<br> &nbsp;..."
"2014-04-18","months","1","31","50100","","2014-03-18","2014-04-18","haiyan-google-media_All-001-010_m1(04)","americares.org","AmeriCares: Haiyan Recovery: $17 Million in Aid to the Philippines","","haiyan","google-media","http://www.americares.org/who-we-are/newsroom/news/monster-cylone-typhoon-haiyan-yolanda-strikes-philippines.html""In the months since <b>Typhoon Haiyan</b> struck, AmeriCares has provided more ... <br> The monstrous typhoon, known locally as <b>Yolanda</b> dealt a massive blow to the&nbsp;..."
"2014-04-18","months","1","31","50100","","2014-03-18","2014-04-18","haiyan-google-media_All-001-010_m1(05)","cnn.com","Prince Charles arranges mass vaccination for Typhoon Haiyan victims","2014-03-26T06:44:06Z","haiyan","google-media","http://www.cnn.com/2014/03/26/world/asia/philippines-prince-charles-measles-vaccination/""The virus has ravaged the country since <b>Typhoon Haiyan</b> -- known as <b>Yolanda</b> in <br> the Philippines -- hit on November 8 last year, leaving more than 6,000 dead&nbsp;..."
"2014-04-18","months","1","31","50100","","2014-03-18","2014-04-18","haiyan-google-media_All-001-010_m1(06)","who.int","WHO | Philippines","","haiyan","google-media","http://www.who.int/hac/crises/phl/en/""Philippines <b>Typhoon Haiyan</b> (<b>Yolanda</b>) 2013. Partially damaged Community <br> Health Center in Jaro, Leyte. WHO/Philippines. Partially damaged Community&nbsp;..."
"2014-04-18","months","1","31","50100","","2014-03-18","2014-04-18","haiyan-google-media_All-001-010_m1(07)","news.yahoo.com","Video shows Typhoon Haiyan&apos;s storm surge | Watch the video ...","","haiyan","google-media","http://news.yahoo.com/video/video-shows-typhoon-haiyans-storm-193118634.html""Watch the video Video shows <b>Typhoon Haiyan&#39;s</b> storm surge on Yahoo <b>News</b> . <br> Amateur video shows <b>Typhoon Haiyan</b> ripping through the Philippines, as the&nbsp;..."
"2014-04-18","months","1","31","50100","","2014-03-18","2014-04-18","haiyan-google-media_All-001-010_m1(08)","au.ibtimes.com","German Advisor Warns Another Haiyan-Strong Typhoon Could Hit ...","","haiyan","google-media","http://au.ibtimes.com/articles/546843/20140407/german-advisor-warns-another-haiyan-strong-typhoon.htm""Filipinos walk past homes destroyed by <b>Typhoon Haiyan</b> (Reuters) ... could be as <br> strong as Haiyan (<b>Yolanda</b>) which hit the Philippines in November 2013."
"2014-04-18","months","1","31","50100","","2014-03-18","2014-04-18","haiyan-google-media_All-001-010_m1(09)","unhcr.org","Typhoon Haiyan: Chainsaw donation helps coconut farmers","","haiyan","google-media","http://www.unhcr.org/533984e36.html""<b>News</b> Stories, 31 March 2014 ... In Mercedes and other areas hit by <b>Typhoon</b> <br> <b>Haiyan</b> in the central Philippines&#39; Visayas region, more than 33 million coconut&nbsp;..."
"2014-04-18","months","1","31","50100","","2014-03-18","2014-04-18","haiyan-google-media_All-001-010_m1(10)","rappler.com","Yolanda/Haiyan | Typhoons | Disasters","","haiyan","google-media","http://www.rappler.com/move-ph/issues/disasters/typhoon-yolanda""Super typhoon Yolanda hits the Philippines - News and full coverage by Rappler. <br> ... Aftermath of <b>Yolanda</b> (<b>Typhoon Haiyan</b>): What we know&nbsp;..."
"2014-04-18","months","2","62","77300","","2014-02-15","2014-03-18","haiyan-google-media_All-001-010_m2(02)","redcross.org","Global Red Cross Response Effort Underway in Wake of Typhoon","","haiyan","google-media","http://www.redcross.org/news/article/Red-Cross-Sends-Support-to-Philippines-for-Typhoon-Response""... months on, the global Red Cross network continues to help families rebuild <br> and rebound from <b>Typhoon Haiyan</b>. ... Posted March 05, 2014 , Updated <b>article</b>."
"2014-04-18","months","2","62","77300","","2014-02-15","2014-03-18","haiyan-google-media_All-001-010_m2(04)","en.wikipedia.org","Haiyan - Wikipedia, the free encyclopedia","","haiyan","google-media","http://en.wikipedia.org/wiki/Haiyan""<b>Typhoon Haiyan</b>, a 2013 typhoon; <b>Typhoon Haiyan</b>, a typhoon during the ... led <br> you here, you may wish to change the link to point directly to the intended <b>article</b>."
"2014-04-18","months","2","62","77300","","2014-02-15","2014-03-18","haiyan-google-media_All-001-010_m2(05)","voanews.com","Philippines Coconut Industry Struggles to Recover after Typhoon ...","","haiyan","google-media","http://www.voanews.com/content/philippines-coconut-industry-struggles-to-recover-after-typhon-haiyan/1866180.html""Last December, <b>Typhoon Haiyan&#39;s</b> destructive winds devastated the Philippines. <br> Parts of the archipelago nation are still recovering. ... Complete <b>Coverage</b>&nbsp;..."
"2014-04-18","months","2","62","77300","","2014-02-15","2014-03-18","haiyan-google-media_All-001-010_m2(10)","cbn.com","Typhoon Haiyan Victims Still Struggling, Months Later - World - CBN ...","","haiyan","google-media","http://www.cbn.com/cbnnews/world/2014/February/Typhoon-Haiyan-Victims-Still-Struggling-Months-Later/""<b>Typhoon Haiyan</b> struck the island nation Nov. ... CBN <b>News</b> spoke with Dr. Doug <br> Stringer, president of Somebody Cares International, about the outreach."
"2014-04-18","months","3","93","105000","","2014-01-15","2014-02-15","haiyan-google-media_All-001-010_m3(02)","unicefusa.org","Philippines Super Typhoon Haiyan (Yolanda) | UNICEF USA","","haiyan","google-media","http://www.unicefusa.org/work/emergencies/hurricane-relief/2013-philippines-typhoon-haiyan.html""Super <b>Typhoon Haiyan</b> brought flash floods, landslides and immense destruction <br> to the Philippines. The storm, known locally as &quot;<b>Yolanda</b>,&quot; was one of the most&nbsp;..."
"2014-04-18","months","3","93","105000","","2014-01-15","2014-02-15","haiyan-google-media_All-001-010_m3(05)","csmonitor.com","Typhoon Haiyan: Can Philippines build back better? - CSMonitor.com","","haiyan","google-media","http://www.csmonitor.com/World/Asia-Pacific/2014/0209/Typhoon-Haiyan-Can-Philippines-build-back-better""<b>Typhoon Haiyan</b> may be a window of opportunity for the Philippines to build back <br> better. ... Weekly review of global <b>news</b> and ideas; Balanced, insightful and&nbsp;..."
"2014-04-18","months","3","93","105000","","2014-01-15","2014-02-15","haiyan-google-media_All-001-010_m3(10)","npr.org","&apos;Nothing Is Fixed&apos;: Recovery Is Slow In Typhoon-Hit Philippine City ...","","haiyan","google-media","http://www.npr.org/2014/01/26/266696789/nothing-is-fixed-recovery-is-slow-in-typhoon-hit-philippine-city""<b>Typhoon Haiyan</b> was one of the strongest storms ever recorded at landfall when <br> it struck the Philippines late last year. More than 6000 people were killed and&nbsp;..."
"2014-04-18","months","4","124","460000","","2013-12-15","2014-01-15","haiyan-google-media_All-001-010_m4(06)","mirror.co.uk","Typhoon Haiyan - News, views, gossip, pictures, video - Mirror Online","","haiyan","google-media","http://www.mirror.co.uk/all-about/typhoon%20haiyan""<b>Typhoon Haiyan</b> left thousands dead in The Philippines after it struck on 7 <br> November 2013. The category five super storm - believed to the biggest storm <br> ever to&nbsp;..."
"2014-04-18","months","5","155","469000","","2013-11-14","2013-12-15","haiyan-google-media_All-001-010_m5(01)","en.wikipedia.org","Typhoon Haiyan - Wikipedia, the free encyclopedia","","haiyan","google-media","http://en.wikipedia.org/wiki/Typhoon_Haiyan""<b>Typhoon Haiyan</b>, known as Typhoon <b>Yolanda</b> in the Philippines, was a powerful <br> tropical cyclone that devastated portions of Southeast Asia, particularly the&nbsp;..."
"2014-04-18","months","5","155","469000","","2013-11-14","2013-12-15","haiyan-google-media_All-001-010_m5(02)","cnn.com","Typhoon Haiyan death toll tops 6,000 in the Philippines - CNN.com","2013-12-13T15:15:43Z","haiyan","google-media","http://www.cnn.com/2013/12/13/world/asia/philippines-typhoon-haiyan/""Nearly five weeks after <b>Typhoon Haiyan</b> tore through the Philippines, the <br> government now says more than 6000 people have ... Part of complete <b>coverage</b> <br> on."
"2014-04-18","months","5","155","469000","","2013-11-14","2013-12-15","haiyan-google-media_All-001-010_m5(04)","youtube.com","Super Typhoon HAIYAN (YOLANDA) in Tacloban City, Philippines ...","","haiyan","google-media","http://www.youtube.com/watch?v=4wrgrJwYdy8""iCyclone&#39;s Super <b>Typhoon Haiyan</b> (<b>Yolanda</b>) Chase: Dramatic footage of a <br> monster, Category-5 cyclone making a direct hit on Tacloban City, Leyte, <br> Philippines."
"2014-04-18","months","5","155","469000","","2013-11-14","2013-12-15","haiyan-google-media_All-001-010_m5(05)","bbc.co.uk","BBC News - Typhoon Haiyan","2013/12/09 10:05:24","haiyan","google-media","http://www.bbc.co.uk/news/world-24901032""Aid in numbers Aftermath of <b>Typhoon Haiyan</b>. What kind of aid is needed by the <br> thousands of people affected by <b>Typhoon Haiyan</b>?"
"2014-04-18","months","5","155","469000","","2013-11-14","2013-12-15","haiyan-google-media_All-001-010_m5(06)","usaid.gov","Typhoon Haiyan (Yolanda) | U.S. Agency for International ...","","haiyan","google-media","http://www.usaid.gov/haiyan""On November 8, <b>Typhoon Haiyan</b>—known as Typhoon <b>Yolanda</b> in the <br> Philippines—made landfall in the central Philippines, bringing strong winds and <br> heavy&nbsp;..."
"2014-04-18","months","5","155","469000","","2013-11-14","2013-12-15","haiyan-google-media_All-001-010_m5(07)","familylinks.icrc.org","HAIYAN YOLANDA TYPHOON - Home","","haiyan","google-media","http://familylinks.icrc.org/yolanda-typhoon""HAIYAN <b>YOLANDA</b> TYPHOONRestoring Family Links. Home ... Restoring <br> contact between people separated by <b>Typhoon Haiyan</b>/<b>Yolanda</b>&nbsp;..."
"2014-04-18","months","5","155","469000","","2013-11-14","2013-12-15","haiyan-google-media_All-001-010_m5(08)","online.wsj.com","Typhoon Haiyan: How a Catastrophe Unfolded - WSJ.com","2013-11-27T01:02:00.000Z","haiyan","google-media","http://online.wsj.com/news/articles/SB10001424052702304465604579217671422015220""In Manila, the national capital, government officials also were closely monitoring <br> the progress of <b>Typhoon Haiyan</b>, or <b>Yolanda</b>, as the storm was named locally."
"2014-04-18","months","5","155","469000","","2013-11-14","2013-12-15","haiyan-google-media_All-001-010_m5(10)","worldvision.org","World Vision responding to Typhoon Haiyan devastation in the ...","","haiyan","google-media","http://www.worldvision.org/news-stories-videos/typhoon-haiyan-response-philippines""<b>Typhoon Haiyan</b>, one of the most powerful storms on record to make landfall, <br> battered the Philippines on November 8 and caused catastrophic damage. World<br> &nbsp;..."
"2014-04-18","months","6","186","553000","","2013-10-14","2013-11-14","haiyan-google-media_All-001-010_m6(07)","nbcnews.com","Typhoon Haiyan: A crisis by the numbers - NBC News","","haiyan","google-media","http://www.nbcnews.com/news/other/typhoon-haiyan-crisis-numbers-f2D11609327""Kevin Frayer / Getty ImagesPhilippines rescue workers search for bodies in the <br> rubble in Tacloban on Saturday.More than a week after one of the most powerful."
"2014-04-18","months","6","186","553000","","2013-10-14","2013-11-14","haiyan-google-media_All-001-010_m6(08)","weather.com","Typhoon Haiyan (Yolanda) Update: Survivors Struggle for Aid ...","","haiyan","google-media","http://www.weather.com/news/weather-hurricanes/super-typhoon-haiyan-latest-news-20131108""Hurricane and Tropical Storm <b>news</b> from The Weather Channel. <b>Typhoon Haiyan</b> <br> left the Philippines early Saturday on a path toward Southeast Asia but not&nbsp;..."
"2014-04-18","months","6","186","553000","","2013-10-14","2013-11-14","haiyan-google-media_All-001-010_m6(09)","usatoday.com","Philippines sifting through horror in Typhoon Haiyan","2013-11-10T04:58:45.0000000","haiyan","google-media","http://www.usatoday.com/story/news/world/2013/11/10/typhoon-haiyan-philippines-vietnam/3488431/""An aerial view of buildings destroyed in the aftermath of <b>Typhoon Haiyan</b> on <br> Sunday ...... After two days with no <b>news</b> from her family, elementary teacher <br> Cherry&nbsp;..."
"2014-04-18","months","1","31","1510","","2014-03-18","2014-04-18","haiyan-google-media_Blogs-Social-blogspot.com-001-010_m1(01)","versestyphoonyolanda.blogspot.com","de anza college: &quot;unnatural disaster: typhoon haiyan&quot;","1:03 PM","haiyan","google-media","http://versestyphoonyolanda.blogspot.com/2014/04/de-anza-college-unnatural-disaster.html""[UPDATE: VERSES TYPHOON <b>YOLANDA</b> Editor Eileen R. Tabios and <br> contributors Michelle Bautista and Aileen Ibardaloza will participate in the May 31<br> , 2014&nbsp;..."
"2014-04-18","months","1","31","1510","","2014-03-18","2014-04-18","haiyan-google-media_Blogs-Social-blogspot.com-001-010_m1(02)","ccphilupdate.blogspot.com","Calvary Chapel Yolanda (Haiyan) Relief Update","1:18 PM","haiyan","google-media","http://ccphilupdate.blogspot.com/""It has been four months since <b>Typhoon Haiyan</b> (<b>Yolanda</b>) devastated the <br> Philippines. Nothing was left of U-Turn for Christ/Calvary Chapel Hernani. But by <br> the&nbsp;..."
"2014-04-18","months","1","31","1510","","2014-03-18","2014-04-18","haiyan-google-media_Blogs-Social-blogspot.com-001-010_m1(03)","versestyphoonyolanda.blogspot.com","VERSES TYPHOON YOLANDA","8:56 AM","haiyan","google-media","http://versestyphoonyolanda.blogspot.com/""Super <b>Typhoon Haiyan</b>—known as <b>Yolanda</b> in the Philippines—was the largest <br> storm ever recorded on land, affecting over 14 million people who became&nbsp;..."
"2014-04-18","months","1","31","1510","","2014-03-18","2014-04-18","haiyan-google-media_Blogs-Social-blogspot.com-001-010_m1(04)","jambalayamuzika.blogspot.com","RUNNING DIVA: Haiyan (Typhoon Yolanda) International ...","9:25 AM","haiyan","google-media","http://jambalayamuzika.blogspot.com/2014/03/haiyan-typhoon-yolanda-international.html""Haiyan (Typhoon <b>Yolanda</b>) International Fundraising Art Exhibition, 6-26 April ... <br> Artists Create Exhibition to Support <b>Typhoon Haiyan</b> (<b>Yolanda</b>) Relief Efforts."
"2014-04-18","months","1","31","1510","","2014-03-18","2014-04-18","haiyan-google-media_Blogs-Social-blogspot.com-001-010_m1(05)","vincegotera.blogspot.com","The Man with the Blue Guitar: Hay(na)ku after Haiyan","","haiyan","google-media","http://vincegotera.blogspot.com/2014/03/haynaku-after-haiyan.html""Four months ago, the category 5 super-<b>Typhoon Haiyan</b> (known as Typhoon <br> <b>Yolanda</b> in the Philippines) devastated much of Southeast Asia, particularly the&nbsp;..."
"2014-04-18","months","1","31","1510","","2014-03-18","2014-04-18","haiyan-google-media_Blogs-Social-blogspot.com-001-010_m1(06)","theomed.blogspot.com","Guest Post from a Typhoon Yolanda Reflection by Monalinda Cadiz","5:47 PM","haiyan","google-media","http://theomed.blogspot.com/2014/03/guest-post-from-typhoon-yolanda.html""Not even in those parts, bulldozed just weeks earlier by <b>typhoon Haiyan</b>. ... “I was <br> still pregnant when Typhoon <b>Yolanda</b> came, which is why I had twice the fear."
"2014-04-18","months","1","31","1510","","2014-03-18","2014-04-18","haiyan-google-media_Blogs-Social-blogspot.com-001-010_m1(07)","ccphilupdate.blogspot.com","Calvary Chapel Yolanda (Haiyan) Relief Update: April 2014","1:18 PM","haiyan","google-media","http://ccphilupdate.blogspot.com/2014_04_01_archive.html""Calvary Chapel <b>Yolanda</b> (Haiyan) Relief Update ... else interested in learning <br> about relief efforts in the central Philippines devastated by Super-<b>Typhoon</b> <br> <b>Haiyan</b>."
"2014-04-18","months","1","31","1510","","2014-03-18","2014-04-18","haiyan-google-media_Blogs-Social-blogspot.com-001-010_m1(08)","ccphilupdate.blogspot.com","Calvary Chapel Yolanda (Haiyan) Relief Update: 77,000 pounds of ...","9:39 AM","haiyan","google-media","http://ccphilupdate.blogspot.com/2014/03/77000-pounds-of-relief-goods-are-now-in.html""Calvary Chapel <b>Yolanda</b> (Haiyan) Relief Update ... else interested in learning <br> about relief efforts in the central Philippines devastated by Super-<b>Typhoon</b> <br> <b>Haiyan</b>."
"2014-04-18","months","1","31","1510","","2014-03-18","2014-04-18","haiyan-google-media_Blogs-Social-blogspot.com-001-010_m1(09)","rarejobdailynewsarticle.blogspot.com","Beckham Visits Typhoon Victims in the Philippines | 英会話ニュース ...","","haiyan","google-media","http://rarejobdailynewsarticle.blogspot.com/2014/03/beckham-visits-typhoon-victims-in.html""Read the following words/expressions found in today&#39;s <b>article</b>. ... visited Tacloban<br> , one of the places direly hit by super <b>typhoon Haiyan</b> [HAY-yan] last November."
"2014-04-18","months","1","31","1510","","2014-03-18","2014-04-18","haiyan-google-media_Blogs-Social-blogspot.com-001-010_m1(10)","eileenverbsbooks.blogspot.com","Eileen Verbs Books: LITERARY ACTIVISM","7:38 AM","haiyan","google-media","http://eileenverbsbooks.blogspot.com/2014/04/literary-activism.html""VERSES TYPHOON <b>YOLANDA</b> is being used for activism beyond the literary, ... <br> funds for <b>Typhoon Haiyan</b> (known as &quot;<b>Yolanda</b>&quot; in the Philippines) survivors."
"2014-04-18","months","2","62","2330","","2014-02-15","2014-03-18","haiyan-google-media_Blogs-Social-blogspot.com-001-010_m2(01)","unicefeapro.blogspot.com","Four months after super Typhoon Haiyan: Accounts of girls and ...","","haiyan","google-media","http://unicefeapro.blogspot.com/2014/03/accounts-of-girls-and-women-four-months.html""Four months after super <b>Typhoon Haiyan</b>: Accounts of girls and women. By <br> Sandar ... I believe anything is possible, if we&#39;ve even survived Typhoon <b>Yolanda</b>."
"2014-04-18","months","2","62","2330","","2014-02-15","2014-03-18","haiyan-google-media_Blogs-Social-blogspot.com-001-010_m2(06)","versestyphoonyolanda.blogspot.com","VERSES TYPHOON YOLANDA: A Storm of Filipino Poets","12:59 PM","haiyan","google-media","http://versestyphoonyolanda.blogspot.com/2014/03/verses-typhoon-yolanda-storm-of.html""Super <b>Typhoon Haiyan</b>—known as <b>Yolanda</b> in the Philippines—was the largest <br> storm ever recorded on land, affecting over 14 million people who became&nbsp;..."
"2014-04-18","months","2","62","2330","","2014-02-15","2014-03-18","haiyan-google-media_Blogs-Social-blogspot.com-001-010_m2(08)","ccphilupdate.blogspot.com","Calvary Chapel Yolanda (Haiyan) Relief Update: The House on the ...","1:50 PM","haiyan","google-media","http://ccphilupdate.blogspot.com/2014/03/the-house-on-rock.html""Calvary Chapel <b>Yolanda</b> (Haiyan) Relief Update ... else interested in learning <br> about relief efforts in the central Philippines devastated by Super-<b>Typhoon</b> <br> <b>Haiyan</b>."
"2014-04-18","months","3","93","3380","","2014-01-15","2014-02-15","haiyan-google-media_Blogs-Social-blogspot.com-001-010_m3(04)","unicefeapro.blogspot.com","Typhoon Haiyan: Rebuilding lives, returning to school","","haiyan","google-media","http://unicefeapro.blogspot.com/2014/02/typhoon-haiyan-rebuilding-lives.html""Edegario lives in Tacloban neighbourhood heavily affected by <b>Typhoon Haiyan</b> (<br> local name <b>Yolanda</b>). Three months on, the neighbourhood still bears the signs&nbsp;..."
"2014-04-18","months","3","93","3380","","2014-01-15","2014-02-15","haiyan-google-media_Blogs-Social-blogspot.com-001-010_m3(05)","eileenverbsbooks.blogspot.com","PRE-PUBLISHING SPECIAL as a FUNDRAISER FOR TYPHOON...","9:47 AM","haiyan","google-media","http://eileenverbsbooks.blogspot.com/2014/02/pre-publishing-special-as-fundraiser.html""PRE-PUBLISHING SPECIAL as a FUNDRAISER FOR <b>TYPHOON HAIYAN&#39;S</b> <br> SURVIVORS. [Please Forward] VERSES TYPHOON <b>YOLANDA</b>: A Storm of <br> Filipino&nbsp;..."
"2014-04-18","months","3","93","3380","","2014-01-15","2014-02-15","haiyan-google-media_Blogs-Social-blogspot.com-001-010_m3(06)","unicefeapro.blogspot.com","Tacloban builds back better after Typhoon Haiyan","","haiyan","google-media","http://unicefeapro.blogspot.com/2014/02/tacloban-builds-back-better-after.html""Saturday 8 February marked exactly three months after <b>Typhoon Haiyan</b> (known <br> locally as <b>Yolanda</b>). On this day, after months of following the relief efforts from a<br> &nbsp;..."
"2014-04-18","months","3","93","3380","","2014-01-15","2014-02-15","haiyan-google-media_Blogs-Social-blogspot.com-001-010_m3(07)","irri-news.blogspot.com","IRRI News: IRRI hands over donation to Haiyan fund drive","12:01 PM","haiyan","google-media","http://irri-news.blogspot.com/2014/01/irri-hands-over-donation-to-haiyan-fund.html""IRRI <b>News</b> ... to the Catholic Relief Services (CRS) to support rehabilitation work <br> for survivors of the <b>Typhoon Haiyan</b> (<b>Yolanda</b>) disaster in November 2013."
"2014-04-18","months","3","93","3380","","2014-01-15","2014-02-15","haiyan-google-media_Blogs-Social-blogspot.com-001-010_m3(09)","bobmckerrow.blogspot.com","Latest update on Red Cross work in Typhoon Haiyan (Yolande)","23:24","haiyan","google-media","http://bobmckerrow.blogspot.com/2014/01/latest-update-on-red-cross-work-in.html""Haiyan/ <b>Yolanda</b> relief and recovery operation, iii) an agreed framework for ... <br> WatSan ERU teams were deployed in the field in response to <b>typhoon Haiyan</b>."
"2014-04-18","months","3","93","3380","","2014-01-15","2014-02-15","haiyan-google-media_Blogs-Social-blogspot.com-001-010_m3(10)","unicefeapro.blogspot.com","Starting a new life in day care centres after Typhoon Haiyan","","haiyan","google-media","http://unicefeapro.blogspot.com/2014/02/starting-new-life-in-day-care-centres.html""Christina sings at first day at care centre in <b>Typhoon Haiyan</b>-affected areas ... day <br> care centres in areas affected by <b>Typhoon Haiyan</b> (known locally as <b>Yolanda</b>)."
"2014-04-18","months","4","124","6820","","2013-12-15","2014-01-15","haiyan-google-media_Blogs-Social-blogspot.com-001-010_m4(01)","eileenverbsbooks.blogspot.com","Eileen Verbs Books: VS. TYPHOON HAIYAN THROUGH POETRY","3:29 PM","haiyan","google-media","http://eileenverbsbooks.blogspot.com/2013/12/vs-typhoon-haiyan-through-poetry.html""Super <b>Typhoon Haiyan</b>—known as <b>Yolanda</b> in the Philippines—was the largest <br> storm ever recorded on land, affecting over 11 million people who became&nbsp;..."
"2014-04-18","months","4","124","6820","","2013-12-15","2014-01-15","haiyan-google-media_Blogs-Social-blogspot.com-001-010_m4(10)","irri-news.blogspot.com","IRRI News: IRRI turns over 4 more tons of seed for Haiyan-hit areas","9:59 PM","haiyan","google-media","http://irri-news.blogspot.com/2014/01/irri-turns-over-4-more-tons-of-seed-for.html""Four tons of seeds of high-yielding rice varieties were donated by IRRI on <br> Tuesday, 14 January 2014, for farmer survivors of <b>Typhoon Haiyan</b> (<b>Yolanda</b>)."
"2014-04-18","months","5","155","10900","","2013-11-14","2013-12-15","haiyan-google-media_Blogs-Social-blogspot.com-001-010_m5(01)","ililanimedia.blogspot.com","Ililani Media: Lessons from Typhoon Haiyan (Yolanda)","7:19 AM","haiyan","google-media","http://ililanimedia.blogspot.com/2013/11/lessons-from-typhoon-haiyan-yolanda.html""The devastation of <b>Typhoon Haiyan</b> has made the international press. The <br> typhoon leveled parts of the City of Tacloban, the capitol of Leyte Province."
"2014-04-18","months","5","155","10900","","2013-11-14","2013-12-15","haiyan-google-media_Blogs-Social-blogspot.com-001-010_m5(02)","rvanbroekhoven.blogspot.com","Typhoon Haiyan (Yolanda) - Some Reflections","","haiyan","google-media","http://rvanbroekhoven.blogspot.com/2013/12/typhoon-haiyan-yolanda-some-reflections.html""Perhaps now with the passage of time since the <b>Typhoon Haiyan</b>, or <b>Yolanda</b> as <br> it is known in the Philippines, has hit and caused such devastation, with the&nbsp;..."
"2014-04-18","months","5","155","10900","","2013-11-14","2013-12-15","haiyan-google-media_Blogs-Social-blogspot.com-001-010_m5(03)","maxdefense.blogspot.com","Massive Combined International Aid Sent to Assist Typhoon Haiyan ...","7:48 PM","haiyan","google-media","http://maxdefense.blogspot.com/2013/11/massive-combined-international-aid-sent.html""The Philippines experienced being hit by the largest storm to make landfall in <br> recorded history, the Supertyphoon Haiyan, locally known as <b>Yolanda</b>, and&nbsp;..."
