query_run_date,query_period,periods_back,days_back,raw_result_count,compared_result_count,date_query_start,date_query_end,doc_id,domain,title,date_published,collection,tags,urlsummary
"2014-04-18","months","6","186","222","","2013-10-14","2013-11-14","haiyan-google-media_Traditional-latimes.com-001-010_m6(04)","latimes.com","Video shot in Philippines displays the power of Typhoon Haiyan ...","2013-11-18 08:53:00-0800","haiyan","google-media","http://www.latimes.com/world/worldnow/la-fg-wn-video-philippines-typhoon-haiyan-20131118,0,1273907.story""Video shot in Philippines displays the power of <b>Typhoon Haiyan</b>. print ... 8 storm, <br> known by Filipinos as <b>Yolanda</b>, was one of the most powerful on record. At least&nbsp;..."
"2014-04-18","months","6","186","222","","2013-10-14","2013-11-14","haiyan-google-media_Traditional-latimes.com-001-010_m6(05)","latimes.com","Typhoon Haiyan and the language of disaster - latimes.com","2013-11-17","haiyan","google-media","http://www.latimes.com/opinion/commentary/la-oe-solnit-typhoon-language-20131117,0,438127.story""Survivors of <b>Typhoon Haiyan</b> carry away sacks of rice from a warehouse in the ... <br> <b>coverage</b> threatens to become its own disaster, augmenting the existing one."
"2014-04-18","months","6","186","222","","2013-10-14","2013-11-14","haiyan-google-media_Traditional-latimes.com-001-010_m6(06)","articles.latimes.com","Lesson of Typhoon Haiyan: Tackle climate change, or it will tackle us","","haiyan","google-media","http://articles.latimes.com/2013/nov/12/news/la-ol-typhoon-haiyan-climate-change-20131112""Was man-made global warming responsible for <b>Typhoon Haiyan</b>? Or Superstorm <br> Sandy? Or the recent flooding in Colorado? I don&#39;t know. Neither do you."
"2014-04-18","months","6","186","222","","2013-10-14","2013-11-14","haiyan-google-media_Traditional-latimes.com-001-010_m6(07)","latimes.com","Typhoon Haiyan slams Philippines - latimes.com","","haiyan","google-media","http://www.latimes.com/world/worldnow/la-fg-typhoon-haiyan-blasts-philippines-pictures,0,1416969.photogallery""<b>Typhoon Haiyan</b> slams Philippines ... At least 15 hurt when firetrucks collide in <br> Monterey Park - L.A. Times - California | Local <b>News</b> 04/16/2014, 9:53 p.m.&nbsp;..."
"2014-04-18","months","6","186","222","","2013-10-14","2013-11-14","haiyan-google-media_Traditional-latimes.com-001-010_m6(08)","articles.latimes.com","Typhoon Haiyan: Thousands feared dead in Philippines - Los ...","","haiyan","google-media","http://articles.latimes.com/2013/nov/10/world/la-fg-wn-tyhpoon-haiyan-thousands-feared-dead-in-philippines-20131110""The <b>typhoon Haiyan</b> — also called <b>Yolanda</b> by Filipinos — blew through 36 ... <br> Chu, a medical student in Leyte, was quoted by the Reuters <b>news</b> agency saying."
"2014-04-18","months","6","186","222","","2013-10-14","2013-11-14","haiyan-google-media_Traditional-latimes.com-001-010_m6(10)","articles.latimes.com","Jason Day loses eight relatives in Typhoon Haiyan - Los Angeles ...","","haiyan","google-media","http://articles.latimes.com/2013/nov/18/sports/la-sp-sn-jason-day-typhoon-haiyan-20131118""... including his grandmother -- died in <b>Typhoon Haiyan</b> in the Philippines. ... and <br> hope that any <b>coverage</b> can spread awareness to assist with the relief efforts&nbsp;..."
"2014-04-18","months","1","31","16","","2014-03-18","2014-04-18","haiyan-google-media_Traditional-news.com.au-001-010_m1(01)","news.com.au","Tropical Cyclone Ita crosses Queensland coast north of Cooktown ...","","haiyan","google-media","http://www.news.com.au/national/tropical-cyclone-ita-crosses-queensland-coast-north-of-cooktown-weakens-while-bringing-heavy-rain/story-fncynjr2-1226880411248""Hundreds of Cyclone Ita refugees in Cooktown are returning home to witness <br> firsthand the impact of the storm. Courier Mail; 12 Apr 2014; <b>News</b>/QLD&nbsp;..."
"2014-04-18","months","1","31","16","","2014-03-18","2014-04-18","haiyan-google-media_Traditional-news.com.au-001-010_m1(02)","mobile.news.com.au","Disaster declared in Cooktown as severe Tropical Cyclone Ita ...","","haiyan","google-media","http://mobile.news.com.au/national/queensland/cyclone-ita-could-be-similar-in-force-to-typhoon-haiyan/story-fnii5v6w-1226880411248""Follow our rolling <b>coverage</b> here. ... CM QLD <b>News</b> and Photos ..... He compared <br> Cyclone Ita to <b>Typhoon Haiyan</b> that killed more than 6200 people and was the&nbsp;..."
"2014-04-18","months","1","31","16","","2014-03-18","2014-04-18","haiyan-google-media_Traditional-news.com.au-001-010_m1(03)","news.com.au","Tropical Cyclone Ita crosses Queensland coast north of Cooktown ...","","haiyan","google-media","http://www.news.com.au/national/breaking-news/tropical-cyclone-ita-crosses-queensland-coast-north-of-cooktown-and-threatens-flooding-rains-down-coast/story-e6frfku9-1226880411248""5.45pm: Telstra has reconnected a satellite mobile cell in Hope Vale to return <br> mobile <b>coverage</b> to residents in the area. 4.30pm: Category Cyclone Ita is&nbsp;..."
"2014-04-18","months","1","31","16","","2014-03-18","2014-04-18","haiyan-google-media_Traditional-news.com.au-001-010_m1(04)","news.com.au","News photos | Photo Galleries and News Photos | News Pictures ...","","haiyan","google-media","http://www.news.com.au/heraldsun/news/photos""View the latest <b>News</b> Pictures and Photo Galleries online including ... islands <br> which bore the brunt of <b>Typhoon Haiyan</b>, the full extent of the horror begins... 23&nbsp;..."
"2014-04-18","months","1","31","16","","2014-03-18","2014-04-18","haiyan-google-media_Traditional-news.com.au-001-010_m1(05)","news.com.au","Mystery remains over why Condamine River is bubbling | News.com ...","","haiyan","google-media","http://www.news.com.au/national/queensland/mystery-remains-over-why-condamine-river-is-bubbling/story-fnii5v6w-1226880353660""CATEGORY-FIVE Cyclone Ita has been likened in sheer destructive force to <br> <b>Typhoon Haiyan</b> that last year wiped out parts of South East Asia killing <br> thousands&nbsp;..."
"2014-04-18","months","1","31","16","","2014-03-18","2014-04-18","haiyan-google-media_Traditional-news.com.au-001-010_m1(06)","blogs.news.com.au","Fact-checking Fairfax&apos;s warmist “scientist-in-residence” | Herald Sun ...","","haiyan","google-media","http://blogs.news.com.au/heraldsun/andrewbolt/index.php/heraldsun/comments/fact_checking_fairfaxs_warmist_scientist_in_residence/""The devastating earthquake followed by <b>typhoon Haiyan</b> that battered the <br> Philippines ... An <b>article</b> in TIME magazine in November last year was headed “<br> The&nbsp;..."
"2014-04-18","months","1","31","16","","2014-03-18","2014-04-18","haiyan-google-media_Traditional-news.com.au-001-010_m1(07)","mobile.news.com.au","Disaster declared in Cooktown as severe Tropical Cyclone Ita ...","","haiyan","google-media","http://mobile.news.com.au/national/queensland/disaster-declared-in-cooktown-as-severe-tropical-cyclone-ita-threatens-to-wipe-out-town/story-fnii5v6w-1226880411248""Follow our rolling <b>coverage</b> here. ... Sky <b>News</b>; 11 Apr 2014; <b>News</b> ..... He <br> compared Cyclone Ita to <b>Typhoon Haiyan</b> that killed more than 6200 people and <br> was&nbsp;..."
"2014-04-18","months","1","31","16","","2014-03-18","2014-04-18","haiyan-google-media_Traditional-news.com.au-001-010_m1(08)","news.com.au","RUSH HOUR: The stories you need to know today | News.com.au","","haiyan","google-media","http://www.news.com.au/national/rush-hour-the-stories-you-need-to-know-today/story-fncynjr2-1226880526291""Check <b>news</b>.com.au for all the day&#39;s headlines and read below to find the stories <br> .... been likened in sheer destructive force to <b>Typhoon Haiyan</b> — which last year&nbsp;..."
"2014-04-18","months","1","31","16","","2014-03-18","2014-04-18","haiyan-google-media_Traditional-news.com.au-001-010_m1(09)","news.com.au","These are the riskiest cities in the world for natural disasters | News ...","","haiyan","google-media","http://www.news.com.au/world/these-are-the-riskiest-cities-in-the-world-for-natural-disasters/story-fndir2ev-1226865510436""World <b>News</b> ... The powerful <b>typhoon Haiyan</b> that hit last year was one of the <br> strongest ever to make landfall. Riskiest cities: Go here and you may die . Source:<br> &nbsp;..."
"2014-04-18","months","1","31","16","","2014-03-18","2014-04-18","haiyan-google-media_Traditional-news.com.au-001-010_m1(10)","news.com.au","Landmarks from the Sydney Harbour Bridge to Kuala Lumpur&apos;s ...","","haiyan","google-media","http://www.news.com.au/world/landmarks-from-the-sydney-harbour-bridge-to-kuala-lumpurs-petronas-towers-dim-lights-for-earth-hour-campaign/story-fndir2ev-1226868794794""World <b>News</b> ... effort in the Philippines to bring fibreglass boat technology to <br> coastal communities affected by super <b>typhoon Haiyan</b> in November last year."
"2014-04-18","months","3","93","25","","2014-01-15","2014-02-15","haiyan-google-media_Traditional-news.com.au-001-010_m3(01)","news.com.au","Filipinos thank you for helping them rebuild after Typhoon Haiyan ...","","haiyan","google-media","http://www.news.com.au/technology/online/filipinos-thank-you-for-helping-them-rebuild-after-typhoon-haiyan-via-social-media/story-fnjwmwrh-1226819762762""EXACTLY three months after <b>Typhoon Haiyan</b> hit the Philippines, locals are <br> running ... of Pinoys in saying #PHthankyou for the help given to us during <br> <b>Yolanda</b>!"
"2014-04-18","months","3","93","25","","2014-01-15","2014-02-15","haiyan-google-media_Traditional-news.com.au-001-010_m3(02)","news.com.au","Typhoon Haiyan survivors in the Philippines don&apos;t recognise David ...","","haiyan","google-media","http://www.news.com.au/sport/football/typhoon-haiyan-survivors-in-the-philippines-dont-recognise-david-beckham/story-fndkzvnd-1226826664834""Hundreds of survivors of Super <b>Typhoon Haiyan</b> rushed out of their tent shelters <br> in ... THE bad <b>news</b> keeps on coming for Barcelona, with star striker Neymar and<br> &nbsp;..."
"2014-04-18","months","4","124","56","","2013-12-15","2014-01-15","haiyan-google-media_Traditional-news.com.au-001-010_m4(01)","news.com.au","Over a thousand typhoon Haiyan dead still unburied weeks after storm","","haiyan","google-media","http://www.news.com.au/world/typhoon-haiyan-dead-still-not-buried-seven-weeks-after-storm/story-fndir2ev-1226791267259""OVER a thousand dead victims of super <b>typhoon Haiyan</b> lie unburied, seven <br> weeks after the region was battered by the Philippines&#39; deadliest storm."
"2014-04-18","months","4","124","56","","2013-12-15","2014-01-15","haiyan-google-media_Traditional-news.com.au-001-010_m4(03)","news.com.au","Plan International warns of child trafficking in Philippines after ...","","haiyan","google-media","http://www.news.com.au/world/plan-international-warns-of-child-trafficking-in-philippines-after-typhoon-haiyan/story-fndir2ev-1226799832094""World <b>News</b> ... There are fears children whose parents were killed in <b>Typhoon</b> <br> <b>Haiyan</b> may be targeted for recruitment into the sex trade. Source: ... recruitment <br> of child workers for sex trafficking in a region devastated by Super <b>Typhoon</b> <br> <b>Haiyan</b>."
"2014-04-18","months","4","124","56","","2013-12-15","2014-01-15","haiyan-google-media_Traditional-news.com.au-001-010_m4(05)","news.com.au","CARE Australia worker Jacqui Symonds tells of shock at seeing ...","","haiyan","google-media","http://www.news.com.au/world/care-australia-worker-jacqui-symonds-tells-of-shock-at-seeing-aftermath-of-typhoon-haiyan-in-philippines/story-fndir2ev-1226793862131""http://content5.video.<b>news</b>.com.au/NDM_CP_-. Survivors of <b>typhoon Haiyan</b> in <br> the Philippines celebrate Christmas, many still living in tents and temporary&nbsp;..."
"2014-04-18","months","4","124","56","","2013-12-15","2014-01-15","haiyan-google-media_Traditional-news.com.au-001-010_m4(07)","news.com.au","In typhoon&apos;s wake, Christmas infused with tragedy | News.com.au","","haiyan","google-media","http://www.news.com.au/world/asia/in-typhoons-wake-christmas-infused-with-tragedy/story-fnh81fz8-1226789573154""CHRISTMAS lights blink in a handful of restaurants in Tacloban, but at nightfall, <br> much of this city flattened by <b>Typhoon Haiyan</b> slips into darkness."
"2014-04-18","months","4","124","56","","2013-12-15","2014-01-15","haiyan-google-media_Traditional-news.com.au-001-010_m4(09)","news.com.au","2013 Year in Review: where are they now? | News.com.au","","haiyan","google-media","http://www.news.com.au/world/year-in-review-where-are-they-now/story-fndir2ev-1226792421080""But as 2013 draws to a close, it&#39;s time to reflect on the biggest <b>news</b> events that <br> ..... Sheltering from <b>typhoon Haiyan</b>, Nickson Gensis captured the frightening&nbsp;..."
"2014-04-18","months","5","155","114","","2013-11-14","2013-12-15","haiyan-google-media_Traditional-news.com.au-001-010_m5(01)","news.com.au","Four weeks after typhoon Haiyan, it is mostly the survivors helping ...","","haiyan","google-media","http://www.news.com.au/world/four-weeks-after-typhoon-haiyan-it-is-mostly-the-survivors-helping-recovery-efforts-off-the-ground/story-fndir2ev-1226773943544""Survivors of Super <b>Typhoon Haiyan</b> march during a religious procession in .... A <br> spokeswoman for the local UN office, Orla Fagan, told a <b>news</b> conference on&nbsp;..."
"2014-04-18","months","5","155","114","","2013-11-14","2013-12-15","haiyan-google-media_Traditional-news.com.au-001-010_m5(02)","news.com.au","Typhoon Haiyan death toll could rise to 7000 | News.com.au","","haiyan","google-media","http://www.news.com.au/world/typhoon-haiyan-death-toll-rises-to-5200/story-fndir2ev-1226766486894""The destruction of everything from crops to roads will need to be rebuilt after <br> <b>Typhoon Haiyan</b> devastated huge regions of the Eastern Vasayas. The WSJ&#39;s&nbsp;..."
"2014-04-18","months","5","155","114","","2013-11-14","2013-12-15","haiyan-google-media_Traditional-news.com.au-001-010_m5(06)","news.com.au","Typhoon Haiyan so powerful it ripped bodies from graves in Hernani ...","","haiyan","google-media","http://www.news.com.au/world/typhoon-haiyan-so-powerful-it-ripped-bodies-from-graves-in-hernani-in-the-philippines/story-fndir2ev-1226763490885""World <b>News</b> ... <b>Typhoon Haiyan</b> killed at least 75 people in the small rural town of <br> Hernani. Another 45 are missing. Desperate Haiyan victims rush for food."
"2014-04-18","months","5","155","114","","2013-11-14","2013-12-15","haiyan-google-media_Traditional-news.com.au-001-010_m5(08)","news.com.au","Justin Bieber sings Christmas carols, plays basketball with Typhoon ...","","haiyan","google-media","http://www.news.com.au/entertainment/celebrity-life/justin-bieber-sings-christmas-carols-plays-basketball-with-typhoon-haiyan-victims-in-the-philippines/story-fn907478-1226780207889""Singer Justin Bieber hugs a young survivor of Super <b>Typhoon Haiyan</b> in Palo, <br> Leyte province. Bieber sang to and played basketball with young survivors of the<br> &nbsp;..."
"2014-04-18","months","5","155","114","","2013-11-14","2013-12-15","haiyan-google-media_Traditional-news.com.au-001-010_m5(09)","news.com.au","Singer Alicia Keys pays visit to typhoon Haiyan refugees in the ...","","haiyan","google-media","http://www.news.com.au/entertainment/celebrity-life/singer-alicia-keys-pays-visit-to-typhoon-haiyan-refugees-in-the-philippines/story-fn907478-1226768247672""Alicia Keys distributes gifts to young survivors of Super <b>Typhoon Haiyan</b> at the <br> Philippine Air Force Base in Manila. Picture: AFP Source: AFP. Alicia Keys waves<br> ."
"2014-04-18","months","6","186","128","","2013-10-14","2013-11-14","haiyan-google-media_Traditional-news.com.au-001-010_m6(01)","news.com.au","Typhoon Haiyan: Four dead, one missing as Philippines pummelled ...","","haiyan","google-media","http://www.news.com.au/world/typhoon-haiyan-at-least-three-dead-as-philippines-pummeled-by-super-tyhoon/story-fndir2ev-1226756096237""... half a million displaced as super <b>Typhoon Haiyan</b> pummels the Philippines. ... <br> in Tacloban, Leyte on Friday morning, as typhoon &quot;<b>Yolanda</b>&quot; made landfall in&nbsp;..."
"2014-04-18","months","6","186","128","","2013-10-14","2013-11-14","haiyan-google-media_Traditional-news.com.au-001-010_m6(02)","news.com.au","Deaths reported as super typhoon Haiyan lashes the Philippines ...","","haiyan","google-media","http://www.news.com.au/world/super-typhoon-haiyan-gaining-strength-set-to-hit-philippines/story-fndir2ev-1226755411772""WITH the first deaths confirmed as super <b>typhoon Haiyan</b> smashes through the ... <br> link: http://google.org/crisismap/a/gmail.com/<b>TyphoonYolanda</b>?hl=en&amp;llbox=&nbsp;..."
"2014-04-18","months","6","186","128","","2013-10-14","2013-11-14","haiyan-google-media_Traditional-news.com.au-001-010_m6(03)","news.com.au","Scale of disaster stuns, overwhelms typhoon Haiyan relief efforts ...","","haiyan","google-media","http://www.news.com.au/world/scale-of-disaster-stuns-overwhelms-typhoon-haiyan-relief-efforts/story-fndir2ev-1226757771195""<b>Typhoon Haiyan</b> ... GALLERY: <b>Typhoon Haiyan&#39;s</b> legacy of horror .... which is <br> called <b>Yolanda</b> in the Philippines but is known as Haiyan elsewhere in Asia."
"2014-04-18","months","6","186","128","","2013-10-14","2013-11-14","haiyan-google-media_Traditional-news.com.au-001-010_m6(06)","news.com.au","Super typhoon Haiyan kills more than 10000 in Philippines destruction","","haiyan","google-media","http://www.news.com.au/world/super-typhoon-haiyan-kills-more-than-10000-in-philippines-destruction/story-fndir2ev-1226757095609""Up to 9 million affected by <b>Typhoon Haiyan</b>, 4 million children ... in Manila, told <br> <b>news</b>.com.au it is too early to comprehend the full extent of the destruction."
"2014-04-18","months","6","186","128","","2013-10-14","2013-11-14","haiyan-google-media_Traditional-news.com.au-001-010_m6(07)","news.com.au","Typhoon Haiyan: More than 100 reported dead in Philippines ...","","haiyan","google-media","http://www.news.com.au/world/typhoon-haiyan-more-than-100-reported-dead-in-philippines/story-fndir2ev-1226756265135""4M people affected by Super Typhoon <b>Yolanda</b> acdg to NDRRMC ... <b>Typhoon</b> <br> <b>Haiyan</b> left the Philippines early today on a path toward Southeast Asia, the US&nbsp;..."
"2014-04-18","months","6","186","128","","2013-10-14","2013-11-14","haiyan-google-media_Traditional-news.com.au-001-010_m6(08)","news.com.au","Vietnam heads to shelter as Typhoon Haiyan makes landfall | News ...","","haiyan","google-media","http://www.news.com.au/world/vietnam-heads-to-shelter-as-typhoon-haiyan-hits-coast/story-fndir2ev-1226756771173""MORE than 600000 people have been evacuated amid fears of flooding and <br> damaging winds as a weakened <b>Typhoon Haiyan</b> makes landfall on the <br> northeast&nbsp;..."
"2014-04-18","months","1","31","34","","2014-03-18","2014-04-18","haiyan-google-media_Traditional-nytimes.com-001-010_m1(01)","topics.nytimes.com","Philippines News - Breaking World Philippines News - The New ...","","haiyan","google-media","http://topics.nytimes.com/top/news/international/countriesandterritories/philippines/""World <b>news</b> about the Philippines. Breaking <b>news</b> and archival information about <br> its people, politics and economy from The New York Times."
"2014-04-18","months","1","31","34","","2014-03-18","2014-04-18","haiyan-google-media_Traditional-nytimes.com-001-010_m1(02)","topics.nytimes.com","South China Sea - The New York Times","","haiyan","google-media","http://topics.nytimes.com/top/news/international/countriesandterritories/southchinasea/""Breaking <b>news</b> and archival information about its people, politics and economy ... <br> <b>Typhoon Haiyan</b> finishes plowing through the Philippines and takes a right turn&nbsp;..."
"2014-04-18","months","1","31","34","","2014-03-18","2014-04-18","haiyan-google-media_Traditional-nytimes.com-001-010_m1(03)","apps.beta620.nytimes.com","Next article","","haiyan","google-media","http://apps.beta620.nytimes.com/accessible_nytimes/Top+News/2014/04/15/world/asia/chinas-efforts-in-hunt-for-plane-are-seen-as-hurting-more-than-helping.html""... abilities to its domestic audience, and to improve on its response to <b>Typhoon</b> <br> <b>Haiyan</b> in the Philippines last year, which was widely criticized as late and tepid."
"2014-04-18","months","1","31","34","","2014-03-18","2014-04-18","haiyan-google-media_Traditional-nytimes.com-001-010_m1(04)","topics.nytimes.com","Artificial Intelligence News - The New York Times","","haiyan","google-media","http://topics.nytimes.com/top/reference/timestopics/subjects/a/artificial_intelligence/index.html""<b>News</b> about Artificial Intelligence, including commentary and archival articles .... <br> Also on the Minute, brainlike computers and a look back at <b>Typhoon Haiyan</b>."
"2014-04-18","months","1","31","34","","2014-03-18","2014-04-18","haiyan-google-media_Traditional-nytimes.com-001-010_m1(05)","nytimes.com","Complexity of Conflict Leaves Donors Wary of Aiding Syrians ...","2014-03-22","haiyan","google-media","http://www.nytimes.com/2014/03/23/world/middleeast/complexity-of-conflict-leaves-donors-wary-of-aiding-syrians.html""... a tenth of the $16 million it raised for victims of <b>Typhoon Haiyan</b> in the <br> Philippines. ... <b>News</b>, analysis and photos of the conflict that has left more than <br> 100,000&nbsp;..."
"2014-04-18","months","1","31","34","","2014-03-18","2014-04-18","haiyan-google-media_Traditional-nytimes.com-001-010_m1(06)","dotearth.blogs.nytimes.com","POPULATION - Dot Earth Blog - NYTimes.com - NYTimes.com","","haiyan","google-media","http://dotearth.blogs.nytimes.com/category/population/""Here&#39;s an excerpt from the Asahi Shimbun <b>article</b> he forwarded: ... Survivors of <br> <b>Typhoon Haiyan</b> are evacuated by rescue workers from the airport in Tacloban&nbsp;..."
"2014-04-18","months","1","31","34","","2014-03-18","2014-04-18","haiyan-google-media_Traditional-nytimes.com-001-010_m1(07)","nytimes.com","Philippines Travel Guide - Where to Go in the Philippines - New ...","","haiyan","google-media","http://www.nytimes.com/travel/guides/asia/philippines/where-to-go.html""... resisting China. He also talked about the aftermath of <b>Typhoon Haiyan</b>. ... Also <br> on the Minute, brainlike computers and a look back at <b>Typhoon Haiyan</b>. Video&nbsp;..."
"2014-04-18","months","1","31","34","","2014-03-18","2014-04-18","haiyan-google-media_Traditional-nytimes.com-001-010_m1(08)","dotearth.blogs.nytimes.com","DISASTERS - Dot Earth Blog - NYTimes.com - NYTimes.com","","haiyan","google-media","http://dotearth.blogs.nytimes.com/category/disasters/""An excellent Associated Press <b>article</b> provides a great primer. ... Survivors of <br> <b>Typhoon Haiyan</b> are evacuated by rescue workers from the airport in Tacloban <br> city,&nbsp;..."
"2014-04-18","months","1","31","34","","2014-03-18","2014-04-18","haiyan-google-media_Traditional-nytimes.com-001-010_m1(09)","dotearth.blogs.nytimes.com","ASIA - Dot Earth Blog - NYTimes.com - NYTimes.com","","haiyan","google-media","http://dotearth.blogs.nytimes.com/category/geography/asia-geography/""Here&#39;s an excerpt from the Asahi Shimbun <b>article</b> he forwarded: ... Survivors of <br> <b>Typhoon Haiyan</b> are evacuated by rescue workers from the airport in Tacloban&nbsp;..."
"2014-04-18","months","1","31","34","","2014-03-18","2014-04-18","haiyan-google-media_Traditional-nytimes.com-001-010_m1(10)","topics.nytimes.com","Computers and the Internet - News - Times Topics - The New York ...","","haiyan","google-media","http://topics.nytimes.com/top/reference/timestopics/subjects/c/computers_and_the_internet/""<b>News</b> about Computers and the Internet, including commentary and archival ..... <br> Also on the Minute, brainlike computers and a look back at <b>Typhoon Haiyan</b>."
"2014-04-18","months","2","62","55","","2014-02-15","2014-03-18","haiyan-google-media_Traditional-nytimes.com-001-010_m2(06)","nytimes.com","British Floods Could Be a Harbinger - NYTimes.com","2014-03-05","haiyan","google-media","http://www.nytimes.com/2014/03/06/business/international/british-floods-could-be-a-harbinger.html""... winter is small scale compared with the devastation <b>Typhoon Haiyan</b> inflicted <br> on ... Pulitzer Prizes Awarded for <b>Coverage</b> of NSA Secrets and Boston Bombing."
"2014-04-18","months","2","62","55","","2014-02-15","2014-03-18","haiyan-google-media_Traditional-nytimes.com-001-010_m2(08)","topics.nytimes.com","Vietnam News - Breaking World Vietnam News - The New York Times","","haiyan","google-media","http://topics.nytimes.com/top/news/international/countriesandterritories/vietnam/""World <b>news</b> about Vietnam. Breaking <b>news</b> and archival information about its <br> people, politics and economy from The New York Times."
"2014-04-18","months","2","62","55","","2014-02-15","2014-03-18","haiyan-google-media_Traditional-nytimes.com-001-010_m2(10)","nytimes.com","Multimedia and Photos - The New York Times","","haiyan","google-media","http://www.nytimes.com/pages/multimedia/""Tyler Hicks won for his <b>coverage</b> of a terrorist attack at a Nairobi mall, and Josh <br> Haner ..... <b>Typhoon Haiyan</b>, which cut a destructive path across the Philippines,&nbsp;..."
