query_run_date,query_period,periods_back,days_back,raw_result_count,compared_result_count,date_query_start,date_query_end,doc_id,domain,title,date_published,collection,tags,urlsummary
"2014-04-18","months","1","31","3","","2014-03-18","2014-04-18","haiyan-google-media_Independent-alternet.org-001-010_m1(03)","alternet.org","Riots, Towns Gone Dry, Soaring Prices: The Food-Pocalypse Is ...","","haiyan","google-media","http://www.alternet.org/food/riots-towns-gone-dry-soaring-prices-food-pocalypse-already-upon-us""... predicted the IPCC chief Rajendra Pachauri at a morning <b>news</b> conference. ... <br> coconut farmers are struggling to recover from November&#39;s <b>Typhoon Haiyan</b>,&nbsp;..."
"2014-04-18","months","2","62","4","","2014-02-15","2014-03-18","haiyan-google-media_Independent-alternet.org-001-010_m2(04)","alternet.org","Stories by Amy Goodman and Juan Gonzalez | Alternet","","haiyan","google-media","http://www.alternet.org/authors/amy-goodman-and-juan-gonzalez""... Democracy Now! Climate negotiator from the Philippines gave an emotional <br> appeal to the world to address the climate crisis following <b>Typhoon Haiyan</b>."
"2014-04-18","months","4","124","5","","2013-12-15","2014-01-15","haiyan-google-media_Independent-alternet.org-001-010_m4(04)","alternet.org","A Dash of Cold Weather Is No Excuse to Argue That Extreme ...","","haiyan","google-media","http://www.alternet.org/environment/dash-cold-weather-no-excuse-argue-extreme-climate-change-wont-happen""... storms raged, though only one reached epic proportions, <b>Typhoon Haiyan</b> in ... <br> but less than in 2012); climate change media <b>coverage</b> rosemodestly for the&nbsp;..."
"2014-04-18","months","5","155","7","","2013-11-14","2013-12-15","haiyan-google-media_Independent-alternet.org-001-010_m5(02)","alternet.org","Leaked Memo Reveals U.S. Plan to Oppose Helping Poor Nations ...","","haiyan","google-media","http://www.alternet.org/environment/leaked-memo-reveals-us-plan-oppose-helping-poor-nations-adapt-climate-change""While the Philippines continues to reel from the devastating <b>Typhoon Haiyan</b>, <br> U.S. negotiators here in Warsaw are opposing efforts to help ... Liked this <b>article</b>?"
"2014-04-18","months","5","155","7","","2013-11-14","2013-12-15","haiyan-google-media_Independent-alternet.org-001-010_m5(06)","alternet.org","Celebrating the Season without Worshipping Consumerism | Alternet","","haiyan","google-media","http://www.alternet.org/environment/celebrating-season-without-worshipping-consumerism""Or the recent speculation about the role the climate crisis played in Super <br> <b>Typhoon Haiyan</b>, which killed more than 5,600 in the Philippines. ... Liked this <br> <b>article</b>?"
"2014-04-18","months","6","186","17","","2013-10-14","2013-11-14","haiyan-google-media_Independent-alternet.org-001-010_m6(01)","alternet.org","Can We Really Say Climate Change Is to Blame for Typhoon Haiyan ...","","haiyan","google-media","http://www.alternet.org/environment/climate-change-blame-typhoon-haiyan""Just as the world was beginning to take in the almost unimaginable devastation <br> wrought by <b>typhoon Haiyan</b>, a young Filipino diplomat, ... Liked this <b>article</b>?"
"2014-04-18","months","6","186","17","","2013-10-14","2013-11-14","haiyan-google-media_Independent-alternet.org-001-010_m6(02)","alternet.org","Typhoon Haiyan: Philippines Urges Action to Resolve Climate Talks ...","","haiyan","google-media","http://www.alternet.org/environment/typhoon-haiyan-philippines-urges-action-resolve-climate-talks-deadlock-aftermath-storm""The Philippines government has firmly connected the super <b>typhoon Haiyan</b> with <br> ... in an <b>article</b> for the Guardian, in which he challenged climate sceptics to &quot;get&nbsp;..."
"2014-04-18","months","6","186","17","","2013-10-14","2013-11-14","haiyan-google-media_Independent-alternet.org-001-010_m6(04)","alternet.org","Who Is Chief Right Wing Wacko this Week? It Might Surprise You ...","","haiyan","google-media","http://www.alternet.org/tea-party-and-right/who-chief-right-wing-wacko-week-it-might-surprise-you""Christian historian: Abortions caused <b>Typhoon Haiyan</b>. This might come as <b>news</b> <br> to the grieving survivors of <b>Typhoon Haiyan</b> in the Philippines: the cause of the&nbsp;..."
"2014-04-18","months","6","186","17","","2013-10-14","2013-11-14","haiyan-google-media_Independent-alternet.org-001-010_m6(05)","alternet.org","2013 On Track to Be One of the Hottest Years Ever | Alternet","","haiyan","google-media","http://www.alternet.org/news-amp-politics/2013-track-be-one-hottest-years-ever""<b>Typhoon Haiyan</b> is but the latest tragic consequence of global climate change. ... <br> Education. <b>News</b> &amp; Politics ... Man running for cover during <b>Typhoon Haiyan</b>."
"2014-04-18","months","6","186","17","","2013-10-14","2013-11-14","haiyan-google-media_Independent-alternet.org-001-010_m6(06)","alternet.org","&quot;Stop This Madness&quot;: Filipino Climate Chief Begins Hunger Fast to ...","","haiyan","google-media","http://www.alternet.org/environment/climate-negotiator-philippines-gave-emotional-appeal-world-address-climate-crisis""Climate negotiator from the Philippines gave an emotional appeal to the world to <br> address the climate crisis following <b>Typhoon Haiyan</b>. ... Liked this <b>article</b>?"
"2014-04-18","months","6","186","17","","2013-10-14","2013-11-14","haiyan-google-media_Independent-alternet.org-001-010_m6(07)","alternet.org","More Than 1,500 Nurses Sign Up in 24 Hours to Be the First Team ...","","haiyan","google-media","http://www.alternet.org/world/more-1500-nurses-sign-24-hours-be-first-team-sent-philippines""As search and rescue efforts continue in the aftermath of <b>Typhoon Haiyan</b>, the <br> need for long-term, continuous care is essential. That&#39;s why ... Liked this <b>article</b>?"
"2014-04-18","months","6","186","17","","2013-10-14","2013-11-14","haiyan-google-media_Independent-alternet.org-001-010_m6(09)","alternet.org","6 Ways to Spark the Clean Energy Revolution | Alternet","","haiyan","google-media","http://www.alternet.org/environment/6-ways-spark-clean-energy-revolution""... plea to world leaders to take meaningful action on climate change as his <br> country dug itself out of the devastation of <b>Typhoon Haiyan</b>. ... Liked this <b>article</b>?"
"2014-04-18","months","1","31","14","","2014-03-18","2014-04-18","haiyan-google-media_Independent-independent.co.uk-001-010_m1(01)","independent.co.uk","Typhoon survivors take a bath along the road in Tacloban, Philippines","","haiyan","google-media","http://www.independent.co.uk/news/world/asia/typhoon-haiyan-shocking-pictures-reveal-devastation-in-the-philippines-8931206.html?action=gallery&ino=9""... resigns Peaches Geldof Game of Thrones George Osborne Greece Michael <br> Gove. <b>Typhoon Haiyan</b>: Shocking pictures reveal devastation in the Philippines."
"2014-04-18","months","1","31","14","","2014-03-18","2014-04-18","haiyan-google-media_Independent-independent.co.uk-001-010_m1(02)","independent.co.uk","Artist Alicia Keys waving during a visit on evacuees affected by ...","","haiyan","google-media","http://www.independent.co.uk/news/world/asia/typhoon-haiyan-shocking-pictures-reveal-devastation-in-the-philippines-8931206.html?action=gallery&ino=11""... Oculus Rift and Facebook Morning-after pill George Osborne Greece Michael <br> Gove. <b>Typhoon Haiyan</b>: Shocking pictures reveal devastation in the Philippines."
"2014-04-18","months","1","31","14","","2014-03-18","2014-04-18","haiyan-google-media_Independent-independent.co.uk-001-010_m1(03)","independent.co.uk","A typhoon survivor lines up to receive safe drinking water being ...","","haiyan","google-media","http://www.independent.co.uk/news/world/asia/typhoon-haiyan-shocking-pictures-reveal-devastation-in-the-philippines-8931206.html?action=gallery&ino=25""Budget 2014 Pistorius betting New £1 coin George Osborne Greece Michael <br> Gove. <b>Typhoon Haiyan</b>: Shocking pictures reveal devastation in the Philippines."
"2014-04-18","months","1","31","14","","2014-03-18","2014-04-18","haiyan-google-media_Independent-independent.co.uk-001-010_m1(04)","independent.co.uk","New born babies and their mothers share an overcrowded room in ...","","haiyan","google-media","http://www.independent.co.uk/news/world/asia/typhoon-haiyan-shocking-pictures-reveal-devastation-in-the-philippines-8931206.html?action=gallery&ino=39""Ukraine NHS True Detective George Osborne Greece Michael Gove. <b>Typhoon</b> <br> <b>Haiyan</b>: Shocking pictures reveal devastation in the Philippines. 39/50."
"2014-04-18","months","1","31","14","","2014-03-18","2014-04-18","haiyan-google-media_Independent-independent.co.uk-001-010_m1(05)","independent.co.uk","A new born premature baby lays in it&apos;s cot in the children&apos;s and ...","","haiyan","google-media","http://www.independent.co.uk/news/world/asia/typhoon-haiyan-shocking-pictures-reveal-devastation-in-the-philippines-8931206.html?action=gallery&ino=37""IndyNews email: Early morning <b>news</b> headlines (Monday-Friday) ... <b>Typhoon</b> <br> <b>Haiyan</b>: Shocking pictures reveal devastation in the Philippines. 37/50."
"2014-04-18","months","1","31","14","","2014-03-18","2014-04-18","haiyan-google-media_Independent-independent.co.uk-001-010_m1(06)","independent.co.uk","Devastation: The scene in Tacloban in central Philippines after it ...","","haiyan","google-media","http://www.independent.co.uk/news/world/asia/typhoon-haiyan-death-toll-in-philippines-feared-to-exceed-1200-8930927.html?action=gallery""Ukraine NHS True Detective George Osborne Greece Michael Gove. <b>Typhoon</b> <br> <b>Haiyan</b>: Death toll in Philippines feared to exceed 1,200. 1/20. AFP. AP. Reuters."
"2014-04-18","months","1","31","14","","2014-03-18","2014-04-18","haiyan-google-media_Independent-independent.co.uk-001-010_m1(07)","ijobs.independent.co.uk","Typhoon Haiyan Disaster relief vounteers with Kaya Responsible ...","","haiyan","google-media","http://ijobs.independent.co.uk/job/53525/typhoon-haiyan-disaster-relief-vounteers-/?TrackID=7""<b>Typhoon Haiyan</b> Disaster relief vounteers. Recruiter. Kaya Responsible Travel. <br> Posted. 16 April 2014. Closes. 16 May 2014. Ref. Disaster Relief. Location."
"2014-04-18","months","1","31","14","","2014-03-18","2014-04-18","haiyan-google-media_Independent-independent.co.uk-001-010_m1(08)","independent.co.uk","Evidence for human-induced climate change grows as 2013 is ...","","haiyan","google-media","http://www.independent.co.uk/news/science/evidence-for-humaninduced-climate-change-grows-as-2013-is-revealed-as-the-sixthhottest-on-record-9212971.html""<b>News</b> &gt; Science ... of the strongest tropical cyclones to hit land were seen in 2013<br> , notably <b>Typhoon Haiyan</b> which devastated parts of the central Philippines,&nbsp;..."
"2014-04-18","months","1","31","14","","2014-03-18","2014-04-18","haiyan-google-media_Independent-independent.co.uk-001-010_m1(09)","independent.co.uk","Warsaw - latest news, breaking stories and comment - The ...","","haiyan","google-media","http://www.independent.co.uk/topic/Warsaw""<b>Typhoon Haiyan</b> overshadows UN climate change talks in Poland. Tuesday 12 <br> November 2013. Philippines envoy breaks down and vows to stop eating until&nbsp;..."
"2014-04-18","months","1","31","14","","2014-03-18","2014-04-18","haiyan-google-media_Independent-independent.co.uk-001-010_m1(10)","independent.co.uk","Taiwan - latest news, breaking stories and comment - The ...","","haiyan","google-media","http://www.independent.co.uk/topic/Taiwan""<b>Typhoon Haiyan</b>: Monster storm batters optimism over improved Manila tourism <br> links ... <b>news</b>... in his fight for a football stadium in Miami&#39;s port area. <b>News</b>&nbsp;..."
"2014-04-18","months","2","62","24","","2014-02-15","2014-03-18","haiyan-google-media_Independent-independent.co.uk-001-010_m2(01)","independent.co.uk","Taking a selfie while volunteering for Typhoon Haiyan Victims - The ...","","haiyan","google-media","http://www.independent.co.uk/news/uk/home-news/selfie-named-by-oxford-dictionaries-as-the-word-of-2013-8948476.html?action=gallery&ino=3""Taking a selfie while volunteering for <b>Typhoon Haiyan</b> Victims. ... Please provide <br> search keyword(s). Advanced Search &middot; <b>Article</b> archive &middot; Topics. Quantcast."
"2014-04-18","months","2","62","24","","2014-02-15","2014-03-18","haiyan-google-media_Independent-independent.co.uk-001-010_m2(08)","independent.co.uk","Tomnod: How to join the virtual search party scanning satellite ...","","haiyan","google-media","http://www.independent.co.uk/life-style/gadgets-and-tech/tomnod-how-to-join-the-virtual-search-party-scanning-satellite-imagery-for-flight-mh370-9188947.html""... in response to <b>Typhoon Haiyan</b>, which hit the Philippines last November. ... a <br> better world and is a large reason I work here,” Barrington told Mercury <b>News</b>."
"2014-04-18","months","2","62","24","","2014-02-15","2014-03-18","haiyan-google-media_Independent-independent.co.uk-001-010_m2(09)","independent.co.uk","Video: Old boys Zinedine Zidane and Ronaldo teach Young Boys ...","","haiyan","google-media","http://www.independent.co.uk/sport/football/news-and-comment/video-old-boys-zinedine-zidane-and-ronaldo-teach-young-boys-bern-a-lesson-9170761.html""... to help support the recovery efforts in the Philippines after <b>Typhoon Haiyan</b>. ... <br> <b>news</b>Academic speaks out against &#39;Italianglo&#39; - the use of English words in&nbsp;..."
"2014-04-18","months","3","93","31","","2014-01-15","2014-02-15","haiyan-google-media_Independent-independent.co.uk-001-010_m3(01)","independent.co.uk","David Beckham meets child survivors of Typhoon Haiyan in the ...","","haiyan","google-media","http://www.independent.co.uk/news/people/news/david-beckham-meets-child-survivors-of-typhoon-haiyan-in-the-philippines-9129484.html""David Beckham meets child survivors of <b>Typhoon Haiyan</b> in the Philippines ... <br> <b>News</b>. Oscar Pistorius reacts during his trial for the murder of his girlfriend Reeva<br> &nbsp;..."
"2014-04-18","months","4","124","60","","2013-12-15","2014-01-15","haiyan-google-media_Independent-independent.co.uk-001-010_m4(10)","independent.co.uk","A year full of sound and fury, signifying what?","","haiyan","google-media","http://www.independent.co.uk/news/uk/home-news/2013--the-year-in-review-a-year-full-of-sound-and-fury-signifying-what-9027077.html""<b>Typhoon Haiyan</b>, or <b>Yolanda</b>, struck the Philippines with catastrophic force. The <br> cost to the country&#39;s economy was about $15bn. About 4 million people lost their<br> &nbsp;..."
"2014-04-18","months","5","155","114","","2013-11-14","2013-12-15","haiyan-google-media_Independent-independent.co.uk-001-010_m5(02)","independent.co.uk","The aftermath of Typhoon Haiyan: A doctor&apos;s story - Health News ...","","haiyan","google-media","http://www.independent.co.uk/life-style/health-and-families/health-news/the-aftermath-of-typhoon-haiyan-a-doctors-story-8950220.html""I am sitting in the operating theatre tent of my Australian Field Hospital."
"2014-04-18","months","5","155","114","","2013-11-14","2013-12-15","haiyan-google-media_Independent-independent.co.uk-001-010_m5(03)","independent.co.uk","Typhoon Haiyan: British aid total tops £44m after celebrity telethon ...","","haiyan","google-media","http://www.independent.co.uk/news/uk/home-news/typhoon-haiyan-british-aid-total-tops-44m-after-celebrity-telethon-8949702.html""<b>Typhoon Haiyan</b>: British aid total tops £44m after celebrity telethon .... Paul Weller <br> wins damages for his children after images are &#39;plastered&#39; over <b>news</b> site."
"2014-04-18","months","5","155","114","","2013-11-14","2013-12-15","haiyan-google-media_Independent-independent.co.uk-001-010_m5(04)","independent.co.uk","Typhoon Haiyan: Onboard a refugee flight for the displaced victims ...","","haiyan","google-media","http://www.independent.co.uk/life-style/health-and-families/health-news/typhoon-haiyan-onboard-a-refugee-flight-for-the-displaced-victims-of-tacloban-8957709.html""For so many the destruction caused by <b>Typhoon Haiyan</b>, or <b>Yolanda</b> in the local <br> tongue, has meant that any form of reconstruction is impossible. Anyway, with so<br> &nbsp;..."
"2014-04-18","months","5","155","114","","2013-11-14","2013-12-15","haiyan-google-media_Independent-independent.co.uk-001-010_m5(05)","independent.co.uk","Typhoon Haiyan: Hard-hit school rebuilt by British Navy in three days","","haiyan","google-media","http://www.independent.co.uk/news/world/asia/typhoon-haiyan-hardhit-school-rebuilt-by-british-navy-in-three-days-8976227.html""In the devastation left by the trail of <b>Typhoon Haiyan</b>, the prospects of education <br> ... VIDEO. Have you tried new the Independent Digital Edition iPad app? <b>News</b>&nbsp;..."
"2014-04-18","months","5","155","114","","2013-11-14","2013-12-15","haiyan-google-media_Independent-independent.co.uk-001-010_m5(06)","independent.co.uk","Typhoon Haiyan: British public raise over £50m to help people ...","","haiyan","google-media","http://www.independent.co.uk/news/uk/home-news/typhoon-haiyan-british-public-raise-over-50m-to-help-people-affected-in-philippines-8951877.html""<b>Typhoon Haiyan</b>: British public raise over £50m to help people affected in .... <br> <b>news</b>Academic speaks out against &#39;Italianglo&#39; - the use of English words in Italian<br> &nbsp;..."
"2014-04-18","months","5","155","114","","2013-11-14","2013-12-15","haiyan-google-media_Independent-independent.co.uk-001-010_m5(07)","independent.co.uk","Prince Charles warns extreme weather such as Typhoon Haiyan in ...","","haiyan","google-media","http://www.independent.co.uk/news/uk/home-news/prince-charles-warns-extreme-weather-such-as-typhoon-haiyan-in-philippines-are-increasing-as-direct-result-of-manmade-climate-change-8952291.html""Extreme weather events such as <b>Typhoon Haiyan</b> in the Philippines are <br> increasing ... <b>news</b>Academic speaks out against &#39;Italianglo&#39; - the use of English <br> words in&nbsp;..."
"2014-04-18","months","5","155","114","","2013-11-14","2013-12-15","haiyan-google-media_Independent-independent.co.uk-001-010_m5(08)","independent.co.uk","Typhoon Haiyan: The Philippines the world once knew and loved ...","","haiyan","google-media","http://www.independent.co.uk/life-style/health-and-families/health-news/typhoon-haiyan-the-philippines-the-world-once-knew-and-loved-are-beginning-to-reappear-8955512.html""<b>Typhoon Haiyan</b>: The Philippines the world once knew and loved are ... World <br> <b>News</b> in Pictures ... <b>news</b>... in his fight for a football stadium in Miami&#39;s port area."
"2014-04-18","months","5","155","114","","2013-11-14","2013-12-15","haiyan-google-media_Independent-independent.co.uk-001-010_m5(09)","independent.co.uk","Video: Justin Bieber performs to victims of Typhoon Haiyan - News ...","","haiyan","google-media","http://www.independent.co.uk/arts-entertainment/music/news/video-justin-bieber-performs-to-victims-of-typhoon-haiyan-9000220.html""Justin Bieber has visted the Philippines to help <b>Typhoon Haiyan</b> victims. He <br> performed on stage in Tacloban City and handed out supplies and books. <br> Thursday&nbsp;..."
"2014-04-18","months","5","155","114","","2013-11-14","2013-12-15","haiyan-google-media_Independent-independent.co.uk-001-010_m5(10)","independent.co.uk","Typhoon Haiyan: Death toll now over 5,000, authorities say - Asia ...","","haiyan","google-media","http://www.independent.co.uk/news/world/asia/typhoon-haiyan-death-toll-now-over-5000-authorities-say-8959112.html""The regions were battered two weeks ago by fierce winds and tsunami-like storm <br> surges from <b>Typhoon Haiyan</b>, locally called <b>Yolanda</b>. There are 1,611 people&nbsp;..."
"2014-04-18","months","6","186","137","","2013-10-14","2013-11-14","haiyan-google-media_Independent-independent.co.uk-001-010_m6(01)","independent.co.uk","Typhoon Haiyan: Most powerful storm to ever hit land batters ...","","haiyan","google-media","http://www.independent.co.uk/news/world/asia/typhoon-haiyan-most-powerful-storm-to-ever-hit-land-batters-philippines-with-235mph-winds-8926719.html""Click here or &quot;view gallery&quot; to see the <b>Typhoon Haiyan</b> in pictures ... devastating <br> storms, although they are rarely as powerful as Haiyan - named <b>Yolanda</b> locally."
"2014-04-18","months","6","186","137","","2013-10-14","2013-11-14","haiyan-google-media_Independent-independent.co.uk-001-010_m6(02)","independent.co.uk","Typhoon Haiyan: Four million children without food or water in ...","","haiyan","google-media","http://www.independent.co.uk/news/world/asia/typhoon-haiyan-us-and-japan-at-forefront-of-rescue-operation-8938489.html""The UN has estimated 11.5m people are affected by <b>Typhoon Haiyan</b> and that <br> 544,600 people ... <b>news</b>... in his fight for a football stadium in Miami&#39;s port area."
"2014-04-18","months","6","186","137","","2013-10-14","2013-11-14","haiyan-google-media_Independent-independent.co.uk-001-010_m6(04)","independent.co.uk","Typhoon Haiyan: &apos;Every single building. Every single house ...","","haiyan","google-media","http://www.independent.co.uk/news/world/asia/typhoon-haiyan-every-single-building-every-single-house-destroyed--governments-pledge-millions-but-tacloban-is-still-waiting-8933515.html""... four days [since <b>Typhoon Haiyan</b> struck],” said Joan Lumbre-Wilson, a resident <br> of ... tvReview: The suits are still sharp, but Don Draper has lost his edge. <b>News</b>&nbsp;..."
"2014-04-18","months","6","186","137","","2013-10-14","2013-11-14","haiyan-google-media_Independent-independent.co.uk-001-010_m6(05)","independent.co.uk","Typhoon Haiyan: Shocking pictures reveal devastation in the ...","","haiyan","google-media","http://www.independent.co.uk/news/world/asia/typhoon-haiyan-shocking-pictures-reveal-devastation-in-the-philippines-8931206.html""... left by the super <b>typhoon Haiyan</b> after it crashed through the Philippines <br> bringing ... tvReview: The suits are still sharp, but Don Draper has lost his edge. <br> <b>News</b>&nbsp;..."
"2014-04-18","months","6","186","137","","2013-10-14","2013-11-14","haiyan-google-media_Independent-independent.co.uk-001-010_m6(06)","independent.co.uk","Typhoon Haiyan: Chaos rules in Philippines as aid trickles in and ...","","haiyan","google-media","http://www.independent.co.uk/news/world/asia/typhoon-haiyan-chaos-rules-in-philippines-as-aid-trickles-in-and-armed-gangs-loot-supplies-8934184.html""Although aid is beginning to trickle through to survivors of <b>typhoon Haiyan</b>, at <br> least .... The baby&#39;s aunt told ABC <b>News</b> that the child was named after Ms <br> Ortega&#39;s&nbsp;..."
"2014-04-18","months","6","186","137","","2013-10-14","2013-11-14","haiyan-google-media_Independent-independent.co.uk-001-010_m6(09)","independent.co.uk","Typhoon Haiyan: Monster storm batters optimism over improved ...","","haiyan","google-media","http://www.independent.co.uk/travel/news-and-advice/typhoon-haiyan-monster-storm-batters-optimism-over-improved-manila-tourism-links-8928642.html""<b>Typhoon Haiyan</b>: Monster storm batters optimism over improved Manila tourism <br> ... TV The second episode of the hit series featured a surprise for viewers. <b>News</b>&nbsp;..."
"2014-04-18","months","6","186","137","","2013-10-14","2013-11-14","haiyan-google-media_Independent-independent.co.uk-001-010_m6(10)","independent.co.uk","Typhoon Haiyan: National state of calamity declared in Philippines ...","","haiyan","google-media","http://www.independent.co.uk/news/world/asia/typhoon-haiyan-corpses-floated-in-water-hung-in-trees-and-lay-in-debris-8931515.html""Click here to see a gallery of images of devastation from <b>Typhoon Haiyan</b> .... <br> <b>news</b>Schools&#39; take-home teddies &#39;encouraging competitive parenting&#39;. Sport."
"2014-04-18","months","1","31","1","","2014-03-18","2014-04-18","haiyan-google-media_Independent-thedailybeast.com-001-010_m1(01)","thedailybeast.com","Making the Change They Want to See - The Daily Beast","","haiyan","google-media","http://www.thedailybeast.com/witw/articles/2014/04/06/these-entrepreneurs-are-making-the-change-they-want-to-see.html""The company, only in its second year, has already donated or sold about <br> 100,000 units, including an estimated 15,000 to the Philippines after <b>Typhoon</b> <br> <b>Haiyan</b>&nbsp;..."
"2014-04-18","months","3","93","3","","2014-01-15","2014-02-15","haiyan-google-media_Independent-thedailybeast.com-001-010_m3(02)","thedailybeast.com","Veterans - The Daily Beast","","haiyan","google-media","http://www.thedailybeast.com/the-hero-project/topics/veterans.html""... City, the scene of unprecedented destruction from last week&#39;s <b>Typhoon Haiyan</b>. <br> ... Duncan Hunter, R-Calif., participates in a <b>news</b> conference with House&nbsp;..."
"2014-04-18","months","3","93","3","","2014-01-15","2014-02-15","haiyan-google-media_Independent-thedailybeast.com-001-010_m3(03)","thedailybeast.com","Oxfam Cuts Ties to Scarlett Johansson Over SodaStream Ads - The ...","","haiyan","google-media","http://www.thedailybeast.com/articles/2014/01/30/oxfam-cuts-ties-to-scarlett-johansson-over-sodastream-ads.html""World <b>News</b> ... first involvement after the 2004 Indian Ocean tsunami to her recent <br> video appealing for help to the areas hit by <b>Typhoon Haiyan</b> in the Philippines."
